Collect system info:
Linux montague 6.1.0-22-amd64 #1 SMP PREEMPT_DYNAMIC Debian 6.1.94-1 (2024-06-21) x86_64 GNU/Linux

Collect kernel cmdline:
BOOT_IMAGE=/boot/vmlinuz-6.1.0-22-amd64 root=UUID=1956c870-aa2c-4900-8a27-624e649dc78c ro hugepagesz=1GB hugepages=30 default_hugepagesz=1 quiet intel_iommu=on iommu=pt

Collect HugePages info:
AnonHugePages:     12288 kB
ShmemHugePages:        0 kB
FileHugePages:         0 kB
HugePages_Total:       0
HugePages_Free:        0
HugePages_Rsvd:        0
HugePages_Surp:        0
Hugepagesize:       2048 kB

Collect status of dpdk-devbind:

Network devices using DPDK-compatible driver
============================================
0000:b1:01.0 'Ethernet Adaptive Virtual Function 1889' drv=vfio-pci unused=iavf
0000:b1:01.1 'Ethernet Adaptive Virtual Function 1889' drv=vfio-pci unused=iavf
0000:b1:01.2 'Ethernet Adaptive Virtual Function 1889' drv=vfio-pci unused=iavf
0000:b1:01.3 'Ethernet Adaptive Virtual Function 1889' drv=vfio-pci unused=iavf
0000:b1:01.4 'Ethernet Adaptive Virtual Function 1889' drv=vfio-pci unused=iavf
0000:b1:01.5 'Ethernet Adaptive Virtual Function 1889' drv=vfio-pci unused=iavf

Network devices using kernel driver
===================================
0000:01:00.0 'Ethernet Controller X550 1563' if=eno1 drv=ixgbe unused=vfio-pci *Active*
0000:01:00.1 'Ethernet Controller X550 1563' if=eno2 drv=ixgbe unused=vfio-pci 
0000:17:00.0 'I350 Gigabit Network Connection 1521' if=ens1f0 drv=igb unused=vfio-pci 
0000:17:00.1 'I350 Gigabit Network Connection 1521' if=ens1f1 drv=igb unused=vfio-pci 
0000:17:00.2 'I350 Gigabit Network Connection 1521' if=ens1f2 drv=igb unused=vfio-pci 
0000:17:00.3 'I350 Gigabit Network Connection 1521' if=ens1f3 drv=igb unused=vfio-pci 
0000:4b:00.0 'Ethernet Controller E810-XXV for SFP 159b' if=ens9f0 drv=ice unused=vfio-pci 
0000:4b:00.1 'Ethernet Controller E810-XXV for SFP 159b' if=ens9f1 drv=ice unused=vfio-pci 
0000:b1:00.0 'Ethernet Controller E810-XXV for SFP 159b' if=enp177s0f0 drv=ice unused=vfio-pci *Active*
0000:b1:00.1 'Ethernet Controller E810-XXV for SFP 159b' if=enp177s0f1 drv=ice unused=vfio-pci *Active*

No 'Baseband' devices detected
==============================

No 'Crypto' devices detected
============================

DMA devices using kernel driver
===============================
0000:00:01.0 'Ice Lake CBDMA [QuickData Technology] 0b00' drv=ioatdma unused=vfio-pci 
0000:00:01.1 'Ice Lake CBDMA [QuickData Technology] 0b00' drv=ioatdma unused=vfio-pci 
0000:00:01.2 'Ice Lake CBDMA [QuickData Technology] 0b00' drv=ioatdma unused=vfio-pci 
0000:00:01.3 'Ice Lake CBDMA [QuickData Technology] 0b00' drv=ioatdma unused=vfio-pci 
0000:00:01.4 'Ice Lake CBDMA [QuickData Technology] 0b00' drv=ioatdma unused=vfio-pci 
0000:00:01.5 'Ice Lake CBDMA [QuickData Technology] 0b00' drv=ioatdma unused=vfio-pci 
0000:00:01.6 'Ice Lake CBDMA [QuickData Technology] 0b00' drv=ioatdma unused=vfio-pci 
0000:00:01.7 'Ice Lake CBDMA [QuickData Technology] 0b00' drv=ioatdma unused=vfio-pci 
0000:80:01.0 'Ice Lake CBDMA [QuickData Technology] 0b00' drv=ioatdma unused=vfio-pci 
0000:80:01.1 'Ice Lake CBDMA [QuickData Technology] 0b00' drv=ioatdma unused=vfio-pci 
0000:80:01.2 'Ice Lake CBDMA [QuickData Technology] 0b00' drv=ioatdma unused=vfio-pci 
0000:80:01.3 'Ice Lake CBDMA [QuickData Technology] 0b00' drv=ioatdma unused=vfio-pci 
0000:80:01.4 'Ice Lake CBDMA [QuickData Technology] 0b00' drv=ioatdma unused=vfio-pci 
0000:80:01.5 'Ice Lake CBDMA [QuickData Technology] 0b00' drv=ioatdma unused=vfio-pci 
0000:80:01.6 'Ice Lake CBDMA [QuickData Technology] 0b00' drv=ioatdma unused=vfio-pci 
0000:80:01.7 'Ice Lake CBDMA [QuickData Technology] 0b00' drv=ioatdma unused=vfio-pci 

No 'Eventdev' devices detected
==============================

No 'Mempool' devices detected
=============================

No 'Compress' devices detected
==============================

No 'Misc (rawdev)' devices detected
===================================

No 'Regex' devices detected
===========================

No 'ML' devices detected
========================

Collect iommu_groups:
/sys/kernel/iommu_groups/230
/sys/kernel/iommu_groups/174
/sys/kernel/iommu_groups/108
/sys/kernel/iommu_groups/55
/sys/kernel/iommu_groups/259
/sys/kernel/iommu_groups/136
/sys/kernel/iommu_groups/83
/sys/kernel/iommu_groups/17
/sys/kernel/iommu_groups/220
/sys/kernel/iommu_groups/164
/sys/kernel/iommu_groups/45
/sys/kernel/iommu_groups/249
/sys/kernel/iommu_groups/192
/sys/kernel/iommu_groups/126
/sys/kernel/iommu_groups/73
/sys/kernel/iommu_groups/210
/sys/kernel/iommu_groups/154
/sys/kernel/iommu_groups/35
/sys/kernel/iommu_groups/7
/sys/kernel/iommu_groups/239
/sys/kernel/iommu_groups/182
/sys/kernel/iommu_groups/116
/sys/kernel/iommu_groups/63
/sys/kernel/iommu_groups/200
/sys/kernel/iommu_groups/144
/sys/kernel/iommu_groups/91
/sys/kernel/iommu_groups/25
/sys/kernel/iommu_groups/229
/sys/kernel/iommu_groups/172
/sys/kernel/iommu_groups/106
/sys/kernel/iommu_groups/53
/sys/kernel/iommu_groups/257
/sys/kernel/iommu_groups/134
/sys/kernel/iommu_groups/81
/sys/kernel/iommu_groups/15
/sys/kernel/iommu_groups/219
/sys/kernel/iommu_groups/162
/sys/kernel/iommu_groups/43
/sys/kernel/iommu_groups/247
/sys/kernel/iommu_groups/190
/sys/kernel/iommu_groups/124
/sys/kernel/iommu_groups/71
/sys/kernel/iommu_groups/209
/sys/kernel/iommu_groups/152
/sys/kernel/iommu_groups/33
/sys/kernel/iommu_groups/5
/sys/kernel/iommu_groups/237
/sys/kernel/iommu_groups/180
/sys/kernel/iommu_groups/114
/sys/kernel/iommu_groups/61
/sys/kernel/iommu_groups/142
/sys/kernel/iommu_groups/23
/sys/kernel/iommu_groups/227
/sys/kernel/iommu_groups/170
/sys/kernel/iommu_groups/104
/sys/kernel/iommu_groups/51
/sys/kernel/iommu_groups/255
/sys/kernel/iommu_groups/199
/sys/kernel/iommu_groups/132
/sys/kernel/iommu_groups/13
/sys/kernel/iommu_groups/217
/sys/kernel/iommu_groups/160
/sys/kernel/iommu_groups/41
/sys/kernel/iommu_groups/245
/sys/kernel/iommu_groups/189
/sys/kernel/iommu_groups/122
/sys/kernel/iommu_groups/207
/sys/kernel/iommu_groups/150
/sys/kernel/iommu_groups/98
/sys/kernel/iommu_groups/31
/sys/kernel/iommu_groups/3
/sys/kernel/iommu_groups/235
/sys/kernel/iommu_groups/179
/sys/kernel/iommu_groups/112
/sys/kernel/iommu_groups/263
/sys/kernel/iommu_groups/140
/sys/kernel/iommu_groups/88
/sys/kernel/iommu_groups/21
/sys/kernel/iommu_groups/225
/sys/kernel/iommu_groups/169
/sys/kernel/iommu_groups/102
/sys/kernel/iommu_groups/253
/sys/kernel/iommu_groups/197
/sys/kernel/iommu_groups/130
/sys/kernel/iommu_groups/78
/sys/kernel/iommu_groups/11
/sys/kernel/iommu_groups/215
/sys/kernel/iommu_groups/159
/sys/kernel/iommu_groups/243
/sys/kernel/iommu_groups/187
/sys/kernel/iommu_groups/120
/sys/kernel/iommu_groups/68
/sys/kernel/iommu_groups/205
/sys/kernel/iommu_groups/149
/sys/kernel/iommu_groups/96
/sys/kernel/iommu_groups/1
/sys/kernel/iommu_groups/233
/sys/kernel/iommu_groups/177
/sys/kernel/iommu_groups/110
/sys/kernel/iommu_groups/58
/sys/kernel/iommu_groups/261
/sys/kernel/iommu_groups/139
/sys/kernel/iommu_groups/86
/sys/kernel/iommu_groups/223
/sys/kernel/iommu_groups/167
/sys/kernel/iommu_groups/100
/sys/kernel/iommu_groups/48
/sys/kernel/iommu_groups/251
/sys/kernel/iommu_groups/195
/sys/kernel/iommu_groups/129
/sys/kernel/iommu_groups/76
/sys/kernel/iommu_groups/213
/sys/kernel/iommu_groups/157
/sys/kernel/iommu_groups/38
/sys/kernel/iommu_groups/241
/sys/kernel/iommu_groups/185
/sys/kernel/iommu_groups/119
/sys/kernel/iommu_groups/66
/sys/kernel/iommu_groups/203
/sys/kernel/iommu_groups/147
/sys/kernel/iommu_groups/94
/sys/kernel/iommu_groups/28
/sys/kernel/iommu_groups/231
/sys/kernel/iommu_groups/175
/sys/kernel/iommu_groups/109
/sys/kernel/iommu_groups/56
/sys/kernel/iommu_groups/137
/sys/kernel/iommu_groups/84
/sys/kernel/iommu_groups/18
/sys/kernel/iommu_groups/221
/sys/kernel/iommu_groups/165
/sys/kernel/iommu_groups/46
/sys/kernel/iommu_groups/193
/sys/kernel/iommu_groups/127
/sys/kernel/iommu_groups/74
/sys/kernel/iommu_groups/211
/sys/kernel/iommu_groups/155
/sys/kernel/iommu_groups/36
/sys/kernel/iommu_groups/8
/sys/kernel/iommu_groups/183
/sys/kernel/iommu_groups/117
/sys/kernel/iommu_groups/64
/sys/kernel/iommu_groups/201
/sys/kernel/iommu_groups/145
/sys/kernel/iommu_groups/92
/sys/kernel/iommu_groups/26
/sys/kernel/iommu_groups/173
/sys/kernel/iommu_groups/107
/sys/kernel/iommu_groups/54
/sys/kernel/iommu_groups/258
/sys/kernel/iommu_groups/135
/sys/kernel/iommu_groups/82
/sys/kernel/iommu_groups/16
/sys/kernel/iommu_groups/163
/sys/kernel/iommu_groups/44
/sys/kernel/iommu_groups/248
/sys/kernel/iommu_groups/191
/sys/kernel/iommu_groups/125
/sys/kernel/iommu_groups/72
/sys/kernel/iommu_groups/153
/sys/kernel/iommu_groups/34
/sys/kernel/iommu_groups/6
/sys/kernel/iommu_groups/238
/sys/kernel/iommu_groups/181
/sys/kernel/iommu_groups/115
/sys/kernel/iommu_groups/62
/sys/kernel/iommu_groups/143
/sys/kernel/iommu_groups/90
/sys/kernel/iommu_groups/24
/sys/kernel/iommu_groups/228
/sys/kernel/iommu_groups/171
/sys/kernel/iommu_groups/105
/sys/kernel/iommu_groups/52
/sys/kernel/iommu_groups/256
/sys/kernel/iommu_groups/133
/sys/kernel/iommu_groups/80
/sys/kernel/iommu_groups/14
/sys/kernel/iommu_groups/218
/sys/kernel/iommu_groups/161
/sys/kernel/iommu_groups/42
/sys/kernel/iommu_groups/246
/sys/kernel/iommu_groups/123
/sys/kernel/iommu_groups/70
/sys/kernel/iommu_groups/208
/sys/kernel/iommu_groups/151
/sys/kernel/iommu_groups/99
/sys/kernel/iommu_groups/32
/sys/kernel/iommu_groups/4
/sys/kernel/iommu_groups/236
/sys/kernel/iommu_groups/113
/sys/kernel/iommu_groups/60
/sys/kernel/iommu_groups/141
/sys/kernel/iommu_groups/89
/sys/kernel/iommu_groups/22
/sys/kernel/iommu_groups/226
/sys/kernel/iommu_groups/103
/sys/kernel/iommu_groups/50
/sys/kernel/iommu_groups/254
/sys/kernel/iommu_groups/198
/sys/kernel/iommu_groups/131
/sys/kernel/iommu_groups/79
/sys/kernel/iommu_groups/12
/sys/kernel/iommu_groups/216
/sys/kernel/iommu_groups/40
/sys/kernel/iommu_groups/244
/sys/kernel/iommu_groups/188
/sys/kernel/iommu_groups/121
/sys/kernel/iommu_groups/69
/sys/kernel/iommu_groups/206
/sys/kernel/iommu_groups/97
/sys/kernel/iommu_groups/30
/sys/kernel/iommu_groups/2
/sys/kernel/iommu_groups/234
/sys/kernel/iommu_groups/178
/sys/kernel/iommu_groups/111
/sys/kernel/iommu_groups/59
/sys/kernel/iommu_groups/262
/sys/kernel/iommu_groups/87
/sys/kernel/iommu_groups/20
/sys/kernel/iommu_groups/224
/sys/kernel/iommu_groups/168
/sys/kernel/iommu_groups/101
/sys/kernel/iommu_groups/49
/sys/kernel/iommu_groups/252
/sys/kernel/iommu_groups/196
/sys/kernel/iommu_groups/77
/sys/kernel/iommu_groups/10
/sys/kernel/iommu_groups/214
/sys/kernel/iommu_groups/158
/sys/kernel/iommu_groups/39
/sys/kernel/iommu_groups/242
/sys/kernel/iommu_groups/186
/sys/kernel/iommu_groups/67
/sys/kernel/iommu_groups/204
/sys/kernel/iommu_groups/148
/sys/kernel/iommu_groups/95
/sys/kernel/iommu_groups/29
/sys/kernel/iommu_groups/0
/sys/kernel/iommu_groups/232
/sys/kernel/iommu_groups/176
/sys/kernel/iommu_groups/57
/sys/kernel/iommu_groups/260
/sys/kernel/iommu_groups/138
/sys/kernel/iommu_groups/85
/sys/kernel/iommu_groups/19
/sys/kernel/iommu_groups/222
/sys/kernel/iommu_groups/166
/sys/kernel/iommu_groups/47
/sys/kernel/iommu_groups/250
/sys/kernel/iommu_groups/194
/sys/kernel/iommu_groups/128
/sys/kernel/iommu_groups/75
/sys/kernel/iommu_groups/212
/sys/kernel/iommu_groups/156
/sys/kernel/iommu_groups/37
/sys/kernel/iommu_groups/9
/sys/kernel/iommu_groups/240
/sys/kernel/iommu_groups/184
/sys/kernel/iommu_groups/118
/sys/kernel/iommu_groups/65
/sys/kernel/iommu_groups/202
/sys/kernel/iommu_groups/146
/sys/kernel/iommu_groups/93
/sys/kernel/iommu_groups/27

Collect cpu info:
Architecture:                         x86_64
CPU op-mode(s):                       32-bit, 64-bit
Address sizes:                        46 bits physical, 57 bits virtual
Byte Order:                           Little Endian
CPU(s):                               96
On-line CPU(s) list:                  0-95
Vendor ID:                            GenuineIntel
BIOS Vendor ID:                       Intel(R) Corporation
Model name:                           Intel(R) Xeon(R) Gold 5318N CPU @ 2.10GHz
BIOS Model name:                      Intel(R) Xeon(R) Gold 5318N CPU @ 2.10GHz  CPU @ 2.1GHz
BIOS CPU family:                      179
CPU family:                           6
Model:                                106
Thread(s) per core:                   2
Core(s) per socket:                   24
Socket(s):                            2
Stepping:                             6
CPU(s) scaling MHz:                   24%
CPU max MHz:                          3400.0000
CPU min MHz:                          800.0000
BogoMIPS:                             4200.00
Flags:                                fpu vme de pse tsc msr pae mce cx8 apic sep mtrr pge mca cmov pat pse36 clflush dts acpi mmx fxsr sse sse2 ss ht tm pbe syscall nx pdpe1gb rdtscp lm constant_tsc art arch_perfmon pebs bts rep_good nopl xtopology nonstop_tsc cpuid aperfmperf pni pclmulqdq dtes64 monitor ds_cpl vmx smx est tm2 ssse3 sdbg fma cx16 xtpr pdcm pcid dca sse4_1 sse4_2 x2apic movbe popcnt tsc_deadline_timer aes xsave avx f16c rdrand lahf_lm abm 3dnowprefetch cpuid_fault epb cat_l3 invpcid_single intel_ppin ssbd mba ibrs ibpb stibp ibrs_enhanced tpr_shadow vnmi flexpriority ept vpid ept_ad fsgsbase tsc_adjust bmi1 avx2 smep bmi2 erms invpcid cqm rdt_a avx512f avx512dq rdseed adx smap avx512ifma clflushopt clwb intel_pt avx512cd sha_ni avx512bw avx512vl xsaveopt xsavec xgetbv1 xsaves cqm_llc cqm_occup_llc cqm_mbm_total cqm_mbm_local split_lock_detect wbnoinvd dtherm ida arat pln pts hwp hwp_act_window hwp_epp hwp_pkg_req avx512vbmi umip pku ospke avx512_vbmi2 gfni vaes vpclmulqdq avx512_vnni avx512_bitalg tme avx512_vpopcntdq la57 rdpid fsrm md_clear pconfig flush_l1d arch_capabilities
Virtualization:                       VT-x
L1d cache:                            2.3 MiB (48 instances)
L1i cache:                            1.5 MiB (48 instances)
L2 cache:                             60 MiB (48 instances)
L3 cache:                             72 MiB (2 instances)
NUMA node(s):                         2
NUMA node0 CPU(s):                    0-23,48-71
NUMA node1 CPU(s):                    24-47,72-95
Vulnerability Gather data sampling:   Mitigation; Microcode
Vulnerability Itlb multihit:          Not affected
Vulnerability L1tf:                   Not affected
Vulnerability Mds:                    Not affected
Vulnerability Meltdown:               Not affected
Vulnerability Mmio stale data:        Mitigation; Clear CPU buffers; SMT vulnerable
Vulnerability Reg file data sampling: Not affected
Vulnerability Retbleed:               Not affected
Vulnerability Spec rstack overflow:   Not affected
Vulnerability Spec store bypass:      Mitigation; Speculative Store Bypass disabled via prctl
Vulnerability Spectre v1:             Mitigation; usercopy/swapgs barriers and __user pointer sanitization
Vulnerability Spectre v2:             Mitigation; Enhanced / Automatic IBRS; IBPB conditional; RSB filling; PBRSB-eIBRS SW sequence; BHI SW loop, KVM SW loop
Vulnerability Srbds:                  Not affected
Vulnerability Tsx async abort:        Not affected

Collect ethtool info for ens1f0
Settings for ens1f0:
	Supported ports: [ TP ]
	Supported link modes:   10baseT/Half 10baseT/Full
	                        100baseT/Half 100baseT/Full
	                        1000baseT/Full
	Supported pause frame use: Symmetric
	Supports auto-negotiation: Yes
	Supported FEC modes: Not reported
	Advertised link modes:  10baseT/Half 10baseT/Full
	                        100baseT/Half 100baseT/Full
	                        1000baseT/Full
	Advertised pause frame use: Symmetric
	Advertised auto-negotiation: Yes
	Advertised FEC modes: Not reported
	Speed: Unknown!
	Duplex: Unknown! (255)
	Auto-negotiation: on
	Port: Twisted Pair
	PHYAD: 1
	Transceiver: internal
	MDI-X: off (auto)
	Supports Wake-on: pumbg
	Wake-on: g
        Current message level: 0x00000007 (7)
                               drv probe link
	Link detected: no
driver: igb
version: 6.1.0-22-amd64
firmware-version: 1.63, 0x800011a4, 0.387.18
expansion-rom-version: 
bus-info: 0000:17:00.0
supports-statistics: yes
supports-test: yes
supports-eeprom-access: yes
supports-register-dump: yes
supports-priv-flags: yes

Collect ethtool info for ens1f1
Settings for ens1f1:
	Supported ports: [ TP ]
	Supported link modes:   10baseT/Half 10baseT/Full
	                        100baseT/Half 100baseT/Full
	                        1000baseT/Full
	Supported pause frame use: Symmetric
	Supports auto-negotiation: Yes
	Supported FEC modes: Not reported
	Advertised link modes:  10baseT/Half 10baseT/Full
	                        100baseT/Half 100baseT/Full
	                        1000baseT/Full
	Advertised pause frame use: Symmetric
	Advertised auto-negotiation: Yes
	Advertised FEC modes: Not reported
	Speed: Unknown!
	Duplex: Unknown! (255)
	Auto-negotiation: on
	Port: Twisted Pair
	PHYAD: 1
	Transceiver: internal
	MDI-X: off (auto)
	Supports Wake-on: d
	Wake-on: d
        Current message level: 0x00000007 (7)
                               drv probe link
	Link detected: no
driver: igb
version: 6.1.0-22-amd64
firmware-version: 1.63, 0x800011a4, 0.387.18
expansion-rom-version: 
bus-info: 0000:17:00.1
supports-statistics: yes
supports-test: yes
supports-eeprom-access: yes
supports-register-dump: yes
supports-priv-flags: yes

Collect ethtool info for ens1f2
Settings for ens1f2:
	Supported ports: [ TP ]
	Supported link modes:   10baseT/Half 10baseT/Full
	                        100baseT/Half 100baseT/Full
	                        1000baseT/Full
	Supported pause frame use: Symmetric
	Supports auto-negotiation: Yes
	Supported FEC modes: Not reported
	Advertised link modes:  10baseT/Half 10baseT/Full
	                        100baseT/Half 100baseT/Full
	                        1000baseT/Full
	Advertised pause frame use: Symmetric
	Advertised auto-negotiation: Yes
	Advertised FEC modes: Not reported
	Speed: Unknown!
	Duplex: Unknown! (255)
	Auto-negotiation: on
	Port: Twisted Pair
	PHYAD: 1
	Transceiver: internal
	MDI-X: off (auto)
	Supports Wake-on: d
	Wake-on: d
        Current message level: 0x00000007 (7)
                               drv probe link
	Link detected: no
driver: igb
version: 6.1.0-22-amd64
firmware-version: 1.63, 0x800011a4, 0.387.18
expansion-rom-version: 
bus-info: 0000:17:00.2
supports-statistics: yes
supports-test: yes
supports-eeprom-access: yes
supports-register-dump: yes
supports-priv-flags: yes

Collect ethtool info for ens1f3
Settings for ens1f3:
	Supported ports: [ TP ]
	Supported link modes:   10baseT/Half 10baseT/Full
	                        100baseT/Half 100baseT/Full
	                        1000baseT/Full
	Supported pause frame use: Symmetric
	Supports auto-negotiation: Yes
	Supported FEC modes: Not reported
	Advertised link modes:  10baseT/Half 10baseT/Full
	                        100baseT/Half 100baseT/Full
	                        1000baseT/Full
	Advertised pause frame use: Symmetric
	Advertised auto-negotiation: Yes
	Advertised FEC modes: Not reported
	Speed: Unknown!
	Duplex: Unknown! (255)
	Auto-negotiation: on
	Port: Twisted Pair
	PHYAD: 1
	Transceiver: internal
	MDI-X: off (auto)
	Supports Wake-on: d
	Wake-on: d
        Current message level: 0x00000007 (7)
                               drv probe link
	Link detected: no
driver: igb
version: 6.1.0-22-amd64
firmware-version: 1.63, 0x800011a4, 0.387.18
expansion-rom-version: 
bus-info: 0000:17:00.3
supports-statistics: yes
supports-test: yes
supports-eeprom-access: yes
supports-register-dump: yes
supports-priv-flags: yes

Collect ethtool info for ens9f0
Settings for ens9f0:
	Supported ports: [ FIBRE ]
	Supported link modes:   1000baseT/Full
	                        25000baseCR/Full
	                        25000baseSR/Full
	                        1000baseX/Full
	                        10000baseCR/Full
	                        10000baseSR/Full
	                        10000baseLR/Full
	Supported pause frame use: Symmetric
	Supports auto-negotiation: Yes
	Supported FEC modes: None	 RS	 BASER
	Advertised link modes:  25000baseCR/Full
	                        10000baseCR/Full
	Advertised pause frame use: No
	Advertised auto-negotiation: Yes
	Advertised FEC modes: None	 RS	 BASER
	Speed: 25000Mb/s
	Duplex: Full
	Auto-negotiation: off
	Port: Direct Attach Copper
	PHYAD: 0
	Transceiver: internal
	Supports Wake-on: d
	Wake-on: d
        Current message level: 0x00000007 (7)
                               drv probe link
	Link detected: no
driver: ice
version: Kahawai_1.14.9_20240613
firmware-version: 4.20 0x80018f65 0.387.18
expansion-rom-version: 
bus-info: 0000:4b:00.0
supports-statistics: yes
supports-test: yes
supports-eeprom-access: yes
supports-register-dump: yes
supports-priv-flags: yes

Collect ethtool info for eno1
Settings for eno1:
	Supported ports: [ TP ]
	Supported link modes:   100baseT/Full
	                        1000baseT/Full
	                        10000baseT/Full
	                        2500baseT/Full
	                        5000baseT/Full
	Supported pause frame use: Symmetric
	Supports auto-negotiation: Yes
	Supported FEC modes: Not reported
	Advertised link modes:  100baseT/Full
	                        1000baseT/Full
	                        10000baseT/Full
	Advertised pause frame use: Symmetric
	Advertised auto-negotiation: Yes
	Advertised FEC modes: Not reported
	Speed: 1000Mb/s
	Duplex: Full
	Auto-negotiation: on
	Port: Twisted Pair
	PHYAD: 0
	Transceiver: internal
	MDI-X: Unknown
	Supports Wake-on: d
	Wake-on: d
        Current message level: 0x00000007 (7)
                               drv probe link
	Link detected: yes
driver: ixgbe
version: 6.1.0-22-amd64
firmware-version: 0x8000179e, 0.387.18
expansion-rom-version: 
bus-info: 0000:01:00.0
supports-statistics: yes
supports-test: yes
supports-eeprom-access: yes
supports-register-dump: yes
supports-priv-flags: yes

Collect ethtool info for ens9f1
Settings for ens9f1:
	Supported ports: [ FIBRE ]
	Supported link modes:   1000baseT/Full
	                        25000baseCR/Full
	                        25000baseSR/Full
	                        1000baseX/Full
	                        10000baseCR/Full
	                        10000baseSR/Full
	                        10000baseLR/Full
	Supported pause frame use: Symmetric
	Supports auto-negotiation: Yes
	Supported FEC modes: None	 RS	 BASER
	Advertised link modes:  25000baseCR/Full
	                        10000baseCR/Full
	Advertised pause frame use: No
	Advertised auto-negotiation: Yes
	Advertised FEC modes: None	 RS	 BASER
	Speed: 25000Mb/s
	Duplex: Full
	Auto-negotiation: off
	Port: Direct Attach Copper
	PHYAD: 0
	Transceiver: internal
	Supports Wake-on: d
	Wake-on: d
        Current message level: 0x00000007 (7)
                               drv probe link
	Link detected: no
driver: ice
version: Kahawai_1.14.9_20240613
firmware-version: 4.20 0x80018f65 0.387.18
expansion-rom-version: 
bus-info: 0000:4b:00.1
supports-statistics: yes
supports-test: yes
supports-eeprom-access: yes
supports-register-dump: yes
supports-priv-flags: yes

Collect ethtool info for eno2
Settings for eno2:
	Supported ports: [ TP ]
	Supported link modes:   100baseT/Full
	                        1000baseT/Full
	                        10000baseT/Full
	                        2500baseT/Full
	                        5000baseT/Full
	Supported pause frame use: Symmetric
	Supports auto-negotiation: Yes
	Supported FEC modes: Not reported
	Advertised link modes:  100baseT/Full
	                        1000baseT/Full
	                        10000baseT/Full
	Advertised pause frame use: Symmetric
	Advertised auto-negotiation: Yes
	Advertised FEC modes: Not reported
	Speed: Unknown!
	Duplex: Unknown! (255)
	Auto-negotiation: on
	Port: Twisted Pair
	PHYAD: 0
	Transceiver: internal
	MDI-X: Unknown
	Supports Wake-on: d
	Wake-on: d
        Current message level: 0x00000007 (7)
                               drv probe link
	Link detected: no
driver: ixgbe
version: 6.1.0-22-amd64
firmware-version: 0x8000179e, 0.387.18
expansion-rom-version: 
bus-info: 0000:01:00.1
supports-statistics: yes
supports-test: yes
supports-eeprom-access: yes
supports-register-dump: yes
supports-priv-flags: yes

Collect ethtool info for enp177s0f0
Settings for enp177s0f0:
	Supported ports: [ FIBRE ]
	Supported link modes:   1000baseT/Full
	                        25000baseCR/Full
	                        25000baseSR/Full
	                        1000baseX/Full
	                        10000baseCR/Full
	                        10000baseSR/Full
	                        10000baseLR/Full
	Supported pause frame use: Symmetric
	Supports auto-negotiation: Yes
	Supported FEC modes: None	 RS	 BASER
	Advertised link modes:  25000baseCR/Full
	                        10000baseCR/Full
	Advertised pause frame use: No
	Advertised auto-negotiation: Yes
	Advertised FEC modes: None	 RS	 BASER
	Speed: 25000Mb/s
	Duplex: Full
	Auto-negotiation: off
	Port: Direct Attach Copper
	PHYAD: 0
	Transceiver: internal
	Supports Wake-on: d
	Wake-on: d
        Current message level: 0x00000007 (7)
                               drv probe link
	Link detected: yes
driver: ice
version: Kahawai_1.14.9_20240613
firmware-version: 4.20 0x80018f65 0.387.18
expansion-rom-version: 
bus-info: 0000:b1:00.0
supports-statistics: yes
supports-test: yes
supports-eeprom-access: yes
supports-register-dump: yes
supports-priv-flags: yes

Collect ethtool info for enp177s0f1
Settings for enp177s0f1:
	Supported ports: [ FIBRE ]
	Supported link modes:   1000baseT/Full
	                        25000baseCR/Full
	                        25000baseSR/Full
	                        1000baseX/Full
	                        10000baseCR/Full
	                        10000baseSR/Full
	                        10000baseLR/Full
	Supported pause frame use: Symmetric
	Supports auto-negotiation: Yes
	Supported FEC modes: None	 RS	 BASER
	Advertised link modes:  25000baseCR/Full
	                        10000baseCR/Full
	Advertised pause frame use: No
	Advertised auto-negotiation: Yes
	Advertised FEC modes: None	 RS	 BASER
	Speed: 25000Mb/s
	Duplex: Full
	Auto-negotiation: off
	Port: Direct Attach Copper
	PHYAD: 0
	Transceiver: internal
	Supports Wake-on: d
	Wake-on: d
        Current message level: 0x00000007 (7)
                               drv probe link
	Link detected: yes
driver: ice
version: Kahawai_1.14.9_20240613
firmware-version: 4.20 0x80018f65 0.387.18
expansion-rom-version: 
bus-info: 0000:b1:00.1
supports-statistics: yes
supports-test: yes
supports-eeprom-access: yes
supports-register-dump: yes
supports-priv-flags: yes

Collect ethtool info for tun0
Settings for tun0:
	Supported ports: [  ]
	Supported link modes:   Not reported
	Supported pause frame use: No
	Supports auto-negotiation: No
	Supported FEC modes: Not reported
	Advertised link modes:  Not reported
	Advertised pause frame use: No
	Advertised auto-negotiation: No
	Advertised FEC modes: Not reported
	Speed: 10Mb/s
	Duplex: Full
	Auto-negotiation: off
	Port: Twisted Pair
	PHYAD: 0
	Transceiver: internal
	MDI-X: Unknown
        Current message level: 0x00000000 (0)
                              
	Link detected: yes
driver: tun
version: 1.6
firmware-version: 
expansion-rom-version: 
bus-info: tun
supports-statistics: no
supports-test: no
supports-eeprom-access: no
supports-register-dump: no
supports-priv-flags: no

Collect lspci info for 01:00.0
01:00.0 Ethernet controller: Intel Corporation Ethernet Controller X550 (rev 01)
	DeviceName: Onboard LAN1
	Subsystem: Cisco Systems Inc X550-TX 10 Gig LOM
	Control: I/O- Mem+ BusMaster+ SpecCycle- MemWINV- VGASnoop- ParErr- Stepping- SERR- FastB2B- DisINTx+
	Status: Cap+ 66MHz- UDF- FastB2B- ParErr- DEVSEL=fast >TAbort- <TAbort- <MAbort- >SERR- <PERR- INTx-
	Latency: 0, Cache Line Size: 64 bytes
	Interrupt: pin B routed to IRQ 17
	NUMA node: 0
	IOMMU group: 49
	Region 0: Memory at 98800000 (64-bit, prefetchable) [size=4M]
	Region 4: Memory at 98c04000 (64-bit, prefetchable) [size=16K]
	Expansion ROM at 9aa80000 [disabled] [size=512K]
	Capabilities: [40] Power Management version 3
		Flags: PMEClk- DSI+ D1- D2- AuxCurrent=0mA PME(D0+,D1-,D2-,D3hot+,D3cold+)
		Status: D0 NoSoftRst+ PME-Enable- DSel=0 DScale=1 PME-
	Capabilities: [50] MSI: Enable- Count=1/1 Maskable+ 64bit+
		Address: 0000000000000000  Data: 0000
		Masking: 00000000  Pending: 00000000
	Capabilities: [70] MSI-X: Enable+ Count=64 Masked-
		Vector table: BAR=4 offset=00000000
		PBA: BAR=4 offset=00002000
	Capabilities: [a0] Express (v2) Endpoint, MSI 00
		DevCap:	MaxPayload 512 bytes, PhantFunc 0, Latency L0s <512ns, L1 <64us
			ExtTag- AttnBtn- AttnInd- PwrInd- RBE+ FLReset+ SlotPowerLimit 0W
		DevCtl:	CorrErr- NonFatalErr- FatalErr- UnsupReq-
			RlxdOrd+ ExtTag- PhantFunc- AuxPwr- NoSnoop- FLReset-
			MaxPayload 128 bytes, MaxReadReq 4096 bytes
		DevSta:	CorrErr+ NonFatalErr- FatalErr- UnsupReq+ AuxPwr- TransPend-
		LnkCap:	Port #0, Speed 8GT/s, Width x4, ASPM not supported
			ClockPM- Surprise- LLActRep- BwNot- ASPMOptComp+
		LnkCtl:	ASPM Disabled; RCB 64 bytes, Disabled- CommClk+
			ExtSynch- ClockPM- AutWidDis- BWInt- AutBWInt-
		LnkSta:	Speed 8GT/s, Width x4
			TrErr- Train- SlotClk+ DLActive- BWMgmt- ABWMgmt-
		DevCap2: Completion Timeout: Range ABCD, TimeoutDis+ NROPrPrP- LTR+
			 10BitTagComp- 10BitTagReq- OBFF Not Supported, ExtFmt- EETLPPrefix-
			 EmergencyPowerReduction Not Supported, EmergencyPowerReductionInit-
			 FRS- TPHComp- ExtTPHComp-
			 AtomicOpsCap: 32bit- 64bit- 128bitCAS-
		DevCtl2: Completion Timeout: 50us to 50ms, TimeoutDis- LTR+ 10BitTagReq- OBFF Disabled,
			 AtomicOpsCtl: ReqEn-
		LnkCap2: Supported Link Speeds: 2.5-8GT/s, Crosslink- Retimer- 2Retimers- DRS-
		LnkCtl2: Target Link Speed: 2.5GT/s, EnterCompliance- SpeedDis-
			 Transmit Margin: Normal Operating Range, EnterModifiedCompliance- ComplianceSOS-
			 Compliance Preset/De-emphasis: -6dB de-emphasis, 0dB preshoot
		LnkSta2: Current De-emphasis Level: -6dB, EqualizationComplete+ EqualizationPhase1+
			 EqualizationPhase2+ EqualizationPhase3+ LinkEqualizationRequest-
			 Retimer- 2Retimers- CrosslinkRes: unsupported
	Capabilities: [e0] Vital Product Data
		Product Name: Intel X550 LOM                                                    
		Read-only fields:
			[PN] Part number: X550 
			[V0] Vendor specific: MAP 2.93 V0.02 PHY 2.B.B MAC 3.23
			[MN] Manufacture ID: 1137
			[RV] Reserved: checksum good, 0 byte(s) reserved
		End
	Capabilities: [100 v2] Advanced Error Reporting
		UESta:	DLP- SDES- TLP- FCP- CmpltTO- CmpltAbrt- UnxCmplt- RxOF- MalfTLP- ECRC- UnsupReq- ACSViol-
		UEMsk:	DLP- SDES- TLP- FCP- CmpltTO- CmpltAbrt+ UnxCmplt- RxOF- MalfTLP- ECRC- UnsupReq- ACSViol-
		UESvrt:	DLP+ SDES- TLP- FCP+ CmpltTO- CmpltAbrt- UnxCmplt- RxOF+ MalfTLP+ ECRC- UnsupReq- ACSViol-
		CESta:	RxErr- BadTLP- BadDLLP- Rollover- Timeout- AdvNonFatalErr+
		CEMsk:	RxErr- BadTLP- BadDLLP- Rollover- Timeout- AdvNonFatalErr+
		AERCap:	First Error Pointer: 00, ECRCGenCap+ ECRCGenEn- ECRCChkCap+ ECRCChkEn-
			MultHdrRecCap- MultHdrRecEn- TLPPfxPres- HdrLogCap-
		HeaderLog: 00000000 00000000 00000000 00000000
	Capabilities: [140 v1] Device Serial Number 00-00-c9-ff-ff-00-00-00
	Capabilities: [150 v1] Alternative Routing-ID Interpretation (ARI)
		ARICap:	MFVC- ACS-, Next Function: 1
		ARICtl:	MFVC- ACS-, Function Group: 0
	Capabilities: [160 v1] Single Root I/O Virtualization (SR-IOV)
		IOVCap:	Migration- 10BitTagReq- Interrupt Message Number: 000
		IOVCtl:	Enable- Migration- Interrupt- MSE- ARIHierarchy+ 10BitTagReq-
		IOVSta:	Migration-
		Initial VFs: 64, Total VFs: 64, Number of VFs: 0, Function Dependency Link: 00
		VF offset: 128, stride: 2, Device ID: 1565
		Supported Page Size: 00000553, System Page Size: 00000001
		Region 0: Memory at 000000009ae00000 (64-bit, non-prefetchable)
		Region 3: Memory at 000000009ad00000 (64-bit, non-prefetchable)
		VF Migration: offset: 00000000, BIR: 0
	Capabilities: [1a0 v1] Transaction Processing Hints
		No steering table available
	Capabilities: [1b0 v1] Access Control Services
		ACSCap:	SrcValid- TransBlk- ReqRedir- CmpltRedir- UpstreamFwd- EgressCtrl- DirectTrans-
		ACSCtl:	SrcValid- TransBlk- ReqRedir- CmpltRedir- UpstreamFwd- EgressCtrl- DirectTrans-
	Capabilities: [1c0 v1] Latency Tolerance Reporting
		Max snoop latency: 71680ns
		Max no snoop latency: 71680ns
	Capabilities: [1d0 v1] Secondary PCI Express
		LnkCtl3: LnkEquIntrruptEn- PerformEqu-
		LaneErrStat: 0
	Kernel driver in use: ixgbe
	Kernel modules: ixgbe


Collect lspci info for 01:00.1
01:00.1 Ethernet controller: Intel Corporation Ethernet Controller X550 (rev 01)
	DeviceName: Onboard LAN2
	Subsystem: Cisco Systems Inc X550-TX 10 Gig LOM
	Control: I/O- Mem+ BusMaster+ SpecCycle- MemWINV- VGASnoop- ParErr- Stepping- SERR- FastB2B- DisINTx+
	Status: Cap+ 66MHz- UDF- FastB2B- ParErr- DEVSEL=fast >TAbort- <TAbort- <MAbort- >SERR- <PERR- INTx-
	Latency: 0, Cache Line Size: 64 bytes
	Interrupt: pin A routed to IRQ 16
	NUMA node: 0
	IOMMU group: 50
	Region 0: Memory at 98400000 (64-bit, prefetchable) [size=4M]
	Region 4: Memory at 98c00000 (64-bit, prefetchable) [size=16K]
	Expansion ROM at 9aa00000 [disabled] [size=512K]
	Capabilities: [40] Power Management version 3
		Flags: PMEClk- DSI+ D1- D2- AuxCurrent=0mA PME(D0+,D1-,D2-,D3hot+,D3cold+)
		Status: D0 NoSoftRst+ PME-Enable- DSel=0 DScale=1 PME-
	Capabilities: [50] MSI: Enable- Count=1/1 Maskable+ 64bit+
		Address: 0000000000000000  Data: 0000
		Masking: 00000000  Pending: 00000000
	Capabilities: [70] MSI-X: Enable+ Count=64 Masked-
		Vector table: BAR=4 offset=00000000
		PBA: BAR=4 offset=00002000
	Capabilities: [a0] Express (v2) Endpoint, MSI 00
		DevCap:	MaxPayload 512 bytes, PhantFunc 0, Latency L0s <512ns, L1 <64us
			ExtTag- AttnBtn- AttnInd- PwrInd- RBE+ FLReset+ SlotPowerLimit 0W
		DevCtl:	CorrErr- NonFatalErr- FatalErr- UnsupReq-
			RlxdOrd+ ExtTag- PhantFunc- AuxPwr- NoSnoop- FLReset-
			MaxPayload 128 bytes, MaxReadReq 4096 bytes
		DevSta:	CorrErr+ NonFatalErr- FatalErr- UnsupReq+ AuxPwr- TransPend-
		LnkCap:	Port #0, Speed 8GT/s, Width x4, ASPM not supported
			ClockPM- Surprise- LLActRep- BwNot- ASPMOptComp+
		LnkCtl:	ASPM Disabled; RCB 64 bytes, Disabled- CommClk+
			ExtSynch- ClockPM- AutWidDis- BWInt- AutBWInt-
		LnkSta:	Speed 8GT/s, Width x4
			TrErr- Train- SlotClk+ DLActive- BWMgmt- ABWMgmt-
		DevCap2: Completion Timeout: Range ABCD, TimeoutDis+ NROPrPrP- LTR+
			 10BitTagComp- 10BitTagReq- OBFF Not Supported, ExtFmt- EETLPPrefix-
			 EmergencyPowerReduction Not Supported, EmergencyPowerReductionInit-
			 FRS- TPHComp- ExtTPHComp-
			 AtomicOpsCap: 32bit- 64bit- 128bitCAS-
		DevCtl2: Completion Timeout: 50us to 50ms, TimeoutDis- LTR- 10BitTagReq- OBFF Disabled,
			 AtomicOpsCtl: ReqEn-
		LnkSta2: Current De-emphasis Level: -6dB, EqualizationComplete- EqualizationPhase1-
			 EqualizationPhase2- EqualizationPhase3- LinkEqualizationRequest-
			 Retimer- 2Retimers- CrosslinkRes: unsupported
	Capabilities: [e0] Vital Product Data
		Product Name: Intel X550 LOM                                                    
		Read-only fields:
			[PN] Part number: X550 
			[V0] Vendor specific: MAP 2.93 V0.02 PHY 2.B.B MAC 3.23
			[MN] Manufacture ID: 1137
			[RV] Reserved: checksum good, 0 byte(s) reserved
		End
	Capabilities: [100 v2] Advanced Error Reporting
		UESta:	DLP- SDES- TLP- FCP- CmpltTO- CmpltAbrt- UnxCmplt- RxOF- MalfTLP- ECRC- UnsupReq- ACSViol-
		UEMsk:	DLP- SDES- TLP- FCP- CmpltTO- CmpltAbrt+ UnxCmplt- RxOF- MalfTLP- ECRC- UnsupReq- ACSViol-
		UESvrt:	DLP+ SDES- TLP- FCP+ CmpltTO- CmpltAbrt- UnxCmplt- RxOF+ MalfTLP+ ECRC- UnsupReq- ACSViol-
		CESta:	RxErr- BadTLP- BadDLLP- Rollover- Timeout- AdvNonFatalErr+
		CEMsk:	RxErr- BadTLP- BadDLLP- Rollover- Timeout- AdvNonFatalErr+
		AERCap:	First Error Pointer: 00, ECRCGenCap+ ECRCGenEn- ECRCChkCap+ ECRCChkEn-
			MultHdrRecCap- MultHdrRecEn- TLPPfxPres- HdrLogCap-
		HeaderLog: 00000000 00000000 00000000 00000000
	Capabilities: [140 v1] Device Serial Number 00-00-c9-ff-ff-00-00-00
	Capabilities: [150 v1] Alternative Routing-ID Interpretation (ARI)
		ARICap:	MFVC- ACS-, Next Function: 0
		ARICtl:	MFVC- ACS-, Function Group: 0
	Capabilities: [160 v1] Single Root I/O Virtualization (SR-IOV)
		IOVCap:	Migration- 10BitTagReq- Interrupt Message Number: 000
		IOVCtl:	Enable- Migration- Interrupt- MSE- ARIHierarchy- 10BitTagReq-
		IOVSta:	Migration-
		Initial VFs: 64, Total VFs: 64, Number of VFs: 0, Function Dependency Link: 01
		VF offset: 128, stride: 2, Device ID: 1565
		Supported Page Size: 00000553, System Page Size: 00000001
		Region 0: Memory at 000000009ac00000 (64-bit, non-prefetchable)
		Region 3: Memory at 000000009ab00000 (64-bit, non-prefetchable)
		VF Migration: offset: 00000000, BIR: 0
	Capabilities: [1a0 v1] Transaction Processing Hints
		No steering table available
	Capabilities: [1b0 v1] Access Control Services
		ACSCap:	SrcValid- TransBlk- ReqRedir- CmpltRedir- UpstreamFwd- EgressCtrl- DirectTrans-
		ACSCtl:	SrcValid- TransBlk- ReqRedir- CmpltRedir- UpstreamFwd- EgressCtrl- DirectTrans-
	Kernel driver in use: ixgbe
	Kernel modules: ixgbe


Collect lspci info for 17:00.0
17:00.0 Ethernet controller: Intel Corporation I350 Gigabit Network Connection (rev 01)
	Subsystem: Cisco Systems Inc I350 Gigabit Network Connection
	Physical Slot: 1
	Control: I/O- Mem+ BusMaster+ SpecCycle- MemWINV- VGASnoop- ParErr+ Stepping- SERR+ FastB2B- DisINTx+
	Status: Cap+ 66MHz- UDF- FastB2B- ParErr- DEVSEL=fast >TAbort- <TAbort- <MAbort- >SERR- <PERR- INTx-
	Latency: 0, Cache Line Size: 32 bytes
	Interrupt: pin A routed to IRQ 18
	NUMA node: 0
	IOMMU group: 7
	Region 0: Memory at a6000000 (32-bit, non-prefetchable) [size=1M]
	Region 3: Memory at a628c000 (32-bit, non-prefetchable) [size=16K]
	Expansion ROM at a6100000 [disabled] [size=512K]
	Capabilities: [40] Power Management version 3
		Flags: PMEClk- DSI+ D1- D2- AuxCurrent=0mA PME(D0+,D1-,D2-,D3hot+,D3cold+)
		Status: D0 NoSoftRst+ PME-Enable- DSel=0 DScale=1 PME-
	Capabilities: [50] MSI: Enable- Count=1/1 Maskable+ 64bit+
		Address: 0000000000000000  Data: 0000
		Masking: 00000000  Pending: 00000000
	Capabilities: [70] MSI-X: Enable+ Count=10 Masked-
		Vector table: BAR=3 offset=00000000
		PBA: BAR=3 offset=00002000
	Capabilities: [a0] Express (v2) Endpoint, MSI 00
		DevCap:	MaxPayload 512 bytes, PhantFunc 0, Latency L0s <512ns, L1 <64us
			ExtTag- AttnBtn- AttnInd- PwrInd- RBE+ FLReset+ SlotPowerLimit 0W
		DevCtl:	CorrErr+ NonFatalErr+ FatalErr+ UnsupReq-
			RlxdOrd+ ExtTag- PhantFunc- AuxPwr- NoSnoop+ FLReset-
			MaxPayload 512 bytes, MaxReadReq 4096 bytes
		DevSta:	CorrErr+ NonFatalErr- FatalErr- UnsupReq+ AuxPwr+ TransPend-
		LnkCap:	Port #0, Speed 5GT/s, Width x4, ASPM L0s L1, Exit Latency L0s <4us, L1 <32us
			ClockPM- Surprise- LLActRep- BwNot- ASPMOptComp+
		LnkCtl:	ASPM Disabled; RCB 64 bytes, Disabled- CommClk+
			ExtSynch- ClockPM- AutWidDis- BWInt- AutBWInt-
		LnkSta:	Speed 5GT/s, Width x4
			TrErr- Train- SlotClk+ DLActive- BWMgmt- ABWMgmt-
		DevCap2: Completion Timeout: Range ABCD, TimeoutDis+ NROPrPrP- LTR+
			 10BitTagComp- 10BitTagReq- OBFF Not Supported, ExtFmt- EETLPPrefix-
			 EmergencyPowerReduction Not Supported, EmergencyPowerReductionInit-
			 FRS- TPHComp- ExtTPHComp-
			 AtomicOpsCap: 32bit- 64bit- 128bitCAS-
		DevCtl2: Completion Timeout: 260ms to 900ms, TimeoutDis- LTR- 10BitTagReq- OBFF Disabled,
			 AtomicOpsCtl: ReqEn-
		LnkCtl2: Target Link Speed: 5GT/s, EnterCompliance- SpeedDis-
			 Transmit Margin: Normal Operating Range, EnterModifiedCompliance- ComplianceSOS-
			 Compliance Preset/De-emphasis: -6dB de-emphasis, 0dB preshoot
		LnkSta2: Current De-emphasis Level: -3.5dB, EqualizationComplete- EqualizationPhase1-
			 EqualizationPhase2- EqualizationPhase3- LinkEqualizationRequest-
			 Retimer- 2Retimers- CrosslinkRes: unsupported
	Capabilities: [e0] Vital Product Data
		Product Name: Cisco I350-TX 1Gig
		Read-only fields:
			[PN] Part number: I350-TX
			[V0] Vendor specific: 1.6.3-2.14
			[MN] Manufacture ID: 1137
			[RV] Reserved: checksum good, 0 byte(s) reserved
		End
	Capabilities: [100 v2] Advanced Error Reporting
		UESta:	DLP- SDES- TLP- FCP- CmpltTO- CmpltAbrt- UnxCmplt- RxOF- MalfTLP- ECRC- UnsupReq- ACSViol-
		UEMsk:	DLP- SDES- TLP- FCP- CmpltTO- CmpltAbrt- UnxCmplt- RxOF- MalfTLP- ECRC- UnsupReq+ ACSViol-
		UESvrt:	DLP+ SDES+ TLP+ FCP+ CmpltTO- CmpltAbrt- UnxCmplt- RxOF+ MalfTLP+ ECRC- UnsupReq- ACSViol-
		CESta:	RxErr- BadTLP- BadDLLP- Rollover- Timeout- AdvNonFatalErr+
		CEMsk:	RxErr- BadTLP- BadDLLP- Rollover- Timeout- AdvNonFatalErr+
		AERCap:	First Error Pointer: 00, ECRCGenCap+ ECRCGenEn- ECRCChkCap+ ECRCChkEn-
			MultHdrRecCap- MultHdrRecEn- TLPPfxPres- HdrLogCap-
		HeaderLog: 00000000 00000000 00000000 00000000
	Capabilities: [140 v1] Device Serial Number b4-96-91-ff-ff-fa-31-80
	Capabilities: [150 v1] Alternative Routing-ID Interpretation (ARI)
		ARICap:	MFVC- ACS-, Next Function: 1
		ARICtl:	MFVC- ACS-, Function Group: 0
	Capabilities: [160 v1] Single Root I/O Virtualization (SR-IOV)
		IOVCap:	Migration- 10BitTagReq- Interrupt Message Number: 000
		IOVCtl:	Enable- Migration- Interrupt- MSE- ARIHierarchy+ 10BitTagReq-
		IOVSta:	Migration-
		Initial VFs: 8, Total VFs: 8, Number of VFs: 0, Function Dependency Link: 00
		VF offset: 128, stride: 4, Device ID: 1520
		Supported Page Size: 00000553, System Page Size: 00000001
		Region 0: Memory at a6260000 (32-bit, non-prefetchable)
		Region 3: Memory at a6240000 (32-bit, non-prefetchable)
		VF Migration: offset: 00000000, BIR: 0
	Capabilities: [1a0 v1] Transaction Processing Hints
		Device specific mode supported
		Steering table in TPH capability structure
	Capabilities: [1c0 v1] Latency Tolerance Reporting
		Max snoop latency: 0ns
		Max no snoop latency: 0ns
	Capabilities: [1d0 v1] Access Control Services
		ACSCap:	SrcValid- TransBlk- ReqRedir- CmpltRedir- UpstreamFwd- EgressCtrl- DirectTrans-
		ACSCtl:	SrcValid- TransBlk- ReqRedir- CmpltRedir- UpstreamFwd- EgressCtrl- DirectTrans-
	Kernel driver in use: igb
	Kernel modules: igb


Collect lspci info for 17:00.1
17:00.1 Ethernet controller: Intel Corporation I350 Gigabit Network Connection (rev 01)
	Subsystem: Cisco Systems Inc I350 Gigabit Network Connection
	Physical Slot: 1
	Control: I/O- Mem+ BusMaster+ SpecCycle- MemWINV- VGASnoop- ParErr+ Stepping- SERR+ FastB2B- DisINTx+
	Status: Cap+ 66MHz- UDF- FastB2B- ParErr- DEVSEL=fast >TAbort- <TAbort- <MAbort- >SERR- <PERR- INTx-
	Latency: 0, Cache Line Size: 32 bytes
	Interrupt: pin B routed to IRQ 19
	NUMA node: 0
	IOMMU group: 8
	Region 0: Memory at a5f00000 (32-bit, non-prefetchable) [size=1M]
	Region 3: Memory at a6288000 (32-bit, non-prefetchable) [size=16K]
	Capabilities: [40] Power Management version 3
		Flags: PMEClk- DSI+ D1- D2- AuxCurrent=0mA PME(D0+,D1-,D2-,D3hot+,D3cold+)
		Status: D0 NoSoftRst+ PME-Enable- DSel=0 DScale=1 PME-
	Capabilities: [50] MSI: Enable- Count=1/1 Maskable+ 64bit+
		Address: 0000000000000000  Data: 0000
		Masking: 00000000  Pending: 00000000
	Capabilities: [70] MSI-X: Enable+ Count=10 Masked-
		Vector table: BAR=3 offset=00000000
		PBA: BAR=3 offset=00002000
	Capabilities: [a0] Express (v2) Endpoint, MSI 00
		DevCap:	MaxPayload 512 bytes, PhantFunc 0, Latency L0s <512ns, L1 <64us
			ExtTag- AttnBtn- AttnInd- PwrInd- RBE+ FLReset+ SlotPowerLimit 0W
		DevCtl:	CorrErr+ NonFatalErr+ FatalErr+ UnsupReq-
			RlxdOrd+ ExtTag- PhantFunc- AuxPwr- NoSnoop+ FLReset-
			MaxPayload 512 bytes, MaxReadReq 4096 bytes
		DevSta:	CorrErr+ NonFatalErr- FatalErr- UnsupReq+ AuxPwr+ TransPend-
		LnkCap:	Port #0, Speed 5GT/s, Width x4, ASPM L0s L1, Exit Latency L0s <4us, L1 <32us
			ClockPM- Surprise- LLActRep- BwNot- ASPMOptComp+
		LnkCtl:	ASPM Disabled; RCB 64 bytes, Disabled- CommClk+
			ExtSynch- ClockPM- AutWidDis- BWInt- AutBWInt-
		LnkSta:	Speed 5GT/s, Width x4
			TrErr- Train- SlotClk+ DLActive- BWMgmt- ABWMgmt-
		DevCap2: Completion Timeout: Range ABCD, TimeoutDis+ NROPrPrP- LTR+
			 10BitTagComp- 10BitTagReq- OBFF Not Supported, ExtFmt- EETLPPrefix-
			 EmergencyPowerReduction Not Supported, EmergencyPowerReductionInit-
			 FRS- TPHComp- ExtTPHComp-
			 AtomicOpsCap: 32bit- 64bit- 128bitCAS-
		DevCtl2: Completion Timeout: 260ms to 900ms, TimeoutDis- LTR- 10BitTagReq- OBFF Disabled,
			 AtomicOpsCtl: ReqEn-
		LnkSta2: Current De-emphasis Level: -6dB, EqualizationComplete- EqualizationPhase1-
			 EqualizationPhase2- EqualizationPhase3- LinkEqualizationRequest-
			 Retimer- 2Retimers- CrosslinkRes: unsupported
	Capabilities: [e0] Vital Product Data
		Product Name: Cisco I350-TX 1Gig
		Read-only fields:
			[PN] Part number: I350-TX
			[V0] Vendor specific: 1.6.3-2.14
			[MN] Manufacture ID: 1137
			[RV] Reserved: checksum good, 0 byte(s) reserved
		End
	Capabilities: [100 v2] Advanced Error Reporting
		UESta:	DLP- SDES- TLP- FCP- CmpltTO- CmpltAbrt- UnxCmplt- RxOF- MalfTLP- ECRC- UnsupReq- ACSViol-
		UEMsk:	DLP- SDES- TLP- FCP- CmpltTO- CmpltAbrt- UnxCmplt- RxOF- MalfTLP- ECRC- UnsupReq+ ACSViol-
		UESvrt:	DLP+ SDES+ TLP+ FCP+ CmpltTO- CmpltAbrt- UnxCmplt- RxOF+ MalfTLP+ ECRC- UnsupReq- ACSViol-
		CESta:	RxErr- BadTLP- BadDLLP- Rollover- Timeout- AdvNonFatalErr+
		CEMsk:	RxErr- BadTLP- BadDLLP- Rollover- Timeout- AdvNonFatalErr+
		AERCap:	First Error Pointer: 00, ECRCGenCap+ ECRCGenEn- ECRCChkCap+ ECRCChkEn-
			MultHdrRecCap- MultHdrRecEn- TLPPfxPres- HdrLogCap-
		HeaderLog: 00000000 00000000 00000000 00000000
	Capabilities: [140 v1] Device Serial Number b4-96-91-ff-ff-fa-31-80
	Capabilities: [150 v1] Alternative Routing-ID Interpretation (ARI)
		ARICap:	MFVC- ACS-, Next Function: 2
		ARICtl:	MFVC- ACS-, Function Group: 0
	Capabilities: [160 v1] Single Root I/O Virtualization (SR-IOV)
		IOVCap:	Migration- 10BitTagReq- Interrupt Message Number: 000
		IOVCtl:	Enable- Migration- Interrupt- MSE- ARIHierarchy- 10BitTagReq-
		IOVSta:	Migration-
		Initial VFs: 8, Total VFs: 8, Number of VFs: 0, Function Dependency Link: 01
		VF offset: 128, stride: 4, Device ID: 1520
		Supported Page Size: 00000553, System Page Size: 00000001
		Region 0: Memory at a6220000 (32-bit, non-prefetchable)
		Region 3: Memory at a6200000 (32-bit, non-prefetchable)
		VF Migration: offset: 00000000, BIR: 0
	Capabilities: [1a0 v1] Transaction Processing Hints
		Device specific mode supported
		Steering table in TPH capability structure
	Capabilities: [1d0 v1] Access Control Services
		ACSCap:	SrcValid- TransBlk- ReqRedir- CmpltRedir- UpstreamFwd- EgressCtrl- DirectTrans-
		ACSCtl:	SrcValid- TransBlk- ReqRedir- CmpltRedir- UpstreamFwd- EgressCtrl- DirectTrans-
	Kernel driver in use: igb
	Kernel modules: igb


Collect lspci info for 17:00.2
17:00.2 Ethernet controller: Intel Corporation I350 Gigabit Network Connection (rev 01)
	Subsystem: Cisco Systems Inc I350 Gigabit Network Connection
	Physical Slot: 1
	Control: I/O- Mem+ BusMaster+ SpecCycle- MemWINV- VGASnoop- ParErr+ Stepping- SERR+ FastB2B- DisINTx+
	Status: Cap+ 66MHz- UDF- FastB2B- ParErr- DEVSEL=fast >TAbort- <TAbort- <MAbort- >SERR- <PERR- INTx-
	Latency: 0, Cache Line Size: 32 bytes
	Interrupt: pin C routed to IRQ 16
	NUMA node: 0
	IOMMU group: 9
	Region 0: Memory at a5e00000 (32-bit, non-prefetchable) [size=1M]
	Region 3: Memory at a6284000 (32-bit, non-prefetchable) [size=16K]
	Capabilities: [40] Power Management version 3
		Flags: PMEClk- DSI+ D1- D2- AuxCurrent=0mA PME(D0+,D1-,D2-,D3hot+,D3cold+)
		Status: D0 NoSoftRst+ PME-Enable- DSel=0 DScale=1 PME-
	Capabilities: [50] MSI: Enable- Count=1/1 Maskable+ 64bit+
		Address: 0000000000000000  Data: 0000
		Masking: 00000000  Pending: 00000000
	Capabilities: [70] MSI-X: Enable+ Count=10 Masked-
		Vector table: BAR=3 offset=00000000
		PBA: BAR=3 offset=00002000
	Capabilities: [a0] Express (v2) Endpoint, MSI 00
		DevCap:	MaxPayload 512 bytes, PhantFunc 0, Latency L0s <512ns, L1 <64us
			ExtTag- AttnBtn- AttnInd- PwrInd- RBE+ FLReset+ SlotPowerLimit 0W
		DevCtl:	CorrErr+ NonFatalErr+ FatalErr+ UnsupReq-
			RlxdOrd+ ExtTag- PhantFunc- AuxPwr- NoSnoop+ FLReset-
			MaxPayload 512 bytes, MaxReadReq 4096 bytes
		DevSta:	CorrErr+ NonFatalErr- FatalErr- UnsupReq+ AuxPwr+ TransPend-
		LnkCap:	Port #0, Speed 5GT/s, Width x4, ASPM L0s L1, Exit Latency L0s <4us, L1 <32us
			ClockPM- Surprise- LLActRep- BwNot- ASPMOptComp+
		LnkCtl:	ASPM Disabled; RCB 64 bytes, Disabled- CommClk+
			ExtSynch- ClockPM- AutWidDis- BWInt- AutBWInt-
		LnkSta:	Speed 5GT/s, Width x4
			TrErr- Train- SlotClk+ DLActive- BWMgmt- ABWMgmt-
		DevCap2: Completion Timeout: Range ABCD, TimeoutDis+ NROPrPrP- LTR+
			 10BitTagComp- 10BitTagReq- OBFF Not Supported, ExtFmt- EETLPPrefix-
			 EmergencyPowerReduction Not Supported, EmergencyPowerReductionInit-
			 FRS- TPHComp- ExtTPHComp-
			 AtomicOpsCap: 32bit- 64bit- 128bitCAS-
		DevCtl2: Completion Timeout: 260ms to 900ms, TimeoutDis- LTR- 10BitTagReq- OBFF Disabled,
			 AtomicOpsCtl: ReqEn-
		LnkSta2: Current De-emphasis Level: -6dB, EqualizationComplete- EqualizationPhase1-
			 EqualizationPhase2- EqualizationPhase3- LinkEqualizationRequest-
			 Retimer- 2Retimers- CrosslinkRes: unsupported
	Capabilities: [e0] Vital Product Data
		Product Name: Cisco I350-TX 1Gig
		Read-only fields:
			[PN] Part number: I350-TX
			[V0] Vendor specific: 1.6.3-2.14
			[MN] Manufacture ID: 1137
			[RV] Reserved: checksum good, 0 byte(s) reserved
		End
	Capabilities: [100 v2] Advanced Error Reporting
		UESta:	DLP- SDES- TLP- FCP- CmpltTO- CmpltAbrt- UnxCmplt- RxOF- MalfTLP- ECRC- UnsupReq- ACSViol-
		UEMsk:	DLP- SDES- TLP- FCP- CmpltTO- CmpltAbrt- UnxCmplt- RxOF- MalfTLP- ECRC- UnsupReq+ ACSViol-
		UESvrt:	DLP+ SDES+ TLP+ FCP+ CmpltTO- CmpltAbrt- UnxCmplt- RxOF+ MalfTLP+ ECRC- UnsupReq- ACSViol-
		CESta:	RxErr- BadTLP- BadDLLP- Rollover- Timeout- AdvNonFatalErr+
		CEMsk:	RxErr- BadTLP- BadDLLP- Rollover- Timeout- AdvNonFatalErr+
		AERCap:	First Error Pointer: 00, ECRCGenCap+ ECRCGenEn- ECRCChkCap+ ECRCChkEn-
			MultHdrRecCap- MultHdrRecEn- TLPPfxPres- HdrLogCap-
		HeaderLog: 00000000 00000000 00000000 00000000
	Capabilities: [140 v1] Device Serial Number b4-96-91-ff-ff-fa-31-80
	Capabilities: [150 v1] Alternative Routing-ID Interpretation (ARI)
		ARICap:	MFVC- ACS-, Next Function: 3
		ARICtl:	MFVC- ACS-, Function Group: 0
	Capabilities: [160 v1] Single Root I/O Virtualization (SR-IOV)
		IOVCap:	Migration- 10BitTagReq- Interrupt Message Number: 000
		IOVCtl:	Enable- Migration- Interrupt- MSE- ARIHierarchy- 10BitTagReq-
		IOVSta:	Migration-
		Initial VFs: 8, Total VFs: 8, Number of VFs: 0, Function Dependency Link: 02
		VF offset: 128, stride: 4, Device ID: 1520
		Supported Page Size: 00000553, System Page Size: 00000001
		Region 0: Memory at a61e0000 (32-bit, non-prefetchable)
		Region 3: Memory at a61c0000 (32-bit, non-prefetchable)
		VF Migration: offset: 00000000, BIR: 0
	Capabilities: [1a0 v1] Transaction Processing Hints
		Device specific mode supported
		Steering table in TPH capability structure
	Capabilities: [1d0 v1] Access Control Services
		ACSCap:	SrcValid- TransBlk- ReqRedir- CmpltRedir- UpstreamFwd- EgressCtrl- DirectTrans-
		ACSCtl:	SrcValid- TransBlk- ReqRedir- CmpltRedir- UpstreamFwd- EgressCtrl- DirectTrans-
	Kernel driver in use: igb
	Kernel modules: igb


Collect lspci info for 17:00.3
17:00.3 Ethernet controller: Intel Corporation I350 Gigabit Network Connection (rev 01)
	Subsystem: Cisco Systems Inc I350 Gigabit Network Connection
	Physical Slot: 1
	Control: I/O- Mem+ BusMaster+ SpecCycle- MemWINV- VGASnoop- ParErr+ Stepping- SERR+ FastB2B- DisINTx+
	Status: Cap+ 66MHz- UDF- FastB2B- ParErr- DEVSEL=fast >TAbort- <TAbort- <MAbort- >SERR- <PERR- INTx-
	Latency: 0, Cache Line Size: 32 bytes
	Interrupt: pin D routed to IRQ 17
	NUMA node: 0
	IOMMU group: 10
	Region 0: Memory at a5d00000 (32-bit, non-prefetchable) [size=1M]
	Region 3: Memory at a6280000 (32-bit, non-prefetchable) [size=16K]
	Capabilities: [40] Power Management version 3
		Flags: PMEClk- DSI+ D1- D2- AuxCurrent=0mA PME(D0+,D1-,D2-,D3hot+,D3cold+)
		Status: D0 NoSoftRst+ PME-Enable- DSel=0 DScale=1 PME-
	Capabilities: [50] MSI: Enable- Count=1/1 Maskable+ 64bit+
		Address: 0000000000000000  Data: 0000
		Masking: 00000000  Pending: 00000000
	Capabilities: [70] MSI-X: Enable+ Count=10 Masked-
		Vector table: BAR=3 offset=00000000
		PBA: BAR=3 offset=00002000
	Capabilities: [a0] Express (v2) Endpoint, MSI 00
		DevCap:	MaxPayload 512 bytes, PhantFunc 0, Latency L0s <512ns, L1 <64us
			ExtTag- AttnBtn- AttnInd- PwrInd- RBE+ FLReset+ SlotPowerLimit 0W
		DevCtl:	CorrErr+ NonFatalErr+ FatalErr+ UnsupReq-
			RlxdOrd+ ExtTag- PhantFunc- AuxPwr- NoSnoop+ FLReset-
			MaxPayload 512 bytes, MaxReadReq 4096 bytes
		DevSta:	CorrErr+ NonFatalErr- FatalErr- UnsupReq+ AuxPwr+ TransPend-
		LnkCap:	Port #0, Speed 5GT/s, Width x4, ASPM L0s L1, Exit Latency L0s <4us, L1 <32us
			ClockPM- Surprise- LLActRep- BwNot- ASPMOptComp+
		LnkCtl:	ASPM Disabled; RCB 64 bytes, Disabled- CommClk+
			ExtSynch- ClockPM- AutWidDis- BWInt- AutBWInt-
		LnkSta:	Speed 5GT/s, Width x4
			TrErr- Train- SlotClk+ DLActive- BWMgmt- ABWMgmt-
		DevCap2: Completion Timeout: Range ABCD, TimeoutDis+ NROPrPrP- LTR+
			 10BitTagComp- 10BitTagReq- OBFF Not Supported, ExtFmt- EETLPPrefix-
			 EmergencyPowerReduction Not Supported, EmergencyPowerReductionInit-
			 FRS- TPHComp- ExtTPHComp-
			 AtomicOpsCap: 32bit- 64bit- 128bitCAS-
		DevCtl2: Completion Timeout: 260ms to 900ms, TimeoutDis- LTR- 10BitTagReq- OBFF Disabled,
			 AtomicOpsCtl: ReqEn-
		LnkSta2: Current De-emphasis Level: -6dB, EqualizationComplete- EqualizationPhase1-
			 EqualizationPhase2- EqualizationPhase3- LinkEqualizationRequest-
			 Retimer- 2Retimers- CrosslinkRes: unsupported
	Capabilities: [e0] Vital Product Data
		Product Name: Cisco I350-TX 1Gig
		Read-only fields:
			[PN] Part number: I350-TX
			[V0] Vendor specific: 1.6.3-2.14
			[MN] Manufacture ID: 1137
			[RV] Reserved: checksum good, 0 byte(s) reserved
		End
	Capabilities: [100 v2] Advanced Error Reporting
		UESta:	DLP- SDES- TLP- FCP- CmpltTO- CmpltAbrt- UnxCmplt- RxOF- MalfTLP- ECRC- UnsupReq- ACSViol-
		UEMsk:	DLP- SDES- TLP- FCP- CmpltTO- CmpltAbrt- UnxCmplt- RxOF- MalfTLP- ECRC- UnsupReq+ ACSViol-
		UESvrt:	DLP+ SDES+ TLP+ FCP+ CmpltTO- CmpltAbrt- UnxCmplt- RxOF+ MalfTLP+ ECRC- UnsupReq- ACSViol-
		CESta:	RxErr- BadTLP- BadDLLP- Rollover- Timeout- AdvNonFatalErr+
		CEMsk:	RxErr- BadTLP- BadDLLP- Rollover- Timeout- AdvNonFatalErr+
		AERCap:	First Error Pointer: 00, ECRCGenCap+ ECRCGenEn- ECRCChkCap+ ECRCChkEn-
			MultHdrRecCap- MultHdrRecEn- TLPPfxPres- HdrLogCap-
		HeaderLog: 00000000 00000000 00000000 00000000
	Capabilities: [140 v1] Device Serial Number b4-96-91-ff-ff-fa-31-80
	Capabilities: [150 v1] Alternative Routing-ID Interpretation (ARI)
		ARICap:	MFVC- ACS-, Next Function: 0
		ARICtl:	MFVC- ACS-, Function Group: 0
	Capabilities: [160 v1] Single Root I/O Virtualization (SR-IOV)
		IOVCap:	Migration- 10BitTagReq- Interrupt Message Number: 000
		IOVCtl:	Enable- Migration- Interrupt- MSE- ARIHierarchy- 10BitTagReq-
		IOVSta:	Migration-
		Initial VFs: 8, Total VFs: 8, Number of VFs: 0, Function Dependency Link: 03
		VF offset: 128, stride: 4, Device ID: 1520
		Supported Page Size: 00000553, System Page Size: 00000001
		Region 0: Memory at a61a0000 (32-bit, non-prefetchable)
		Region 3: Memory at a6180000 (32-bit, non-prefetchable)
		VF Migration: offset: 00000000, BIR: 0
	Capabilities: [1a0 v1] Transaction Processing Hints
		Device specific mode supported
		Steering table in TPH capability structure
	Capabilities: [1d0 v1] Access Control Services
		ACSCap:	SrcValid- TransBlk- ReqRedir- CmpltRedir- UpstreamFwd- EgressCtrl- DirectTrans-
		ACSCtl:	SrcValid- TransBlk- ReqRedir- CmpltRedir- UpstreamFwd- EgressCtrl- DirectTrans-
	Kernel driver in use: igb
	Kernel modules: igb


Collect lspci info for 4b:00.0
4b:00.0 Ethernet controller: Intel Corporation Ethernet Controller E810-XXV for SFP (rev 02)
	Subsystem: Cisco Systems Inc E810XXVDA2 2x25/10 GbE SFP28 PCIe NIC
	Physical Slot: 9
	Control: I/O- Mem+ BusMaster+ SpecCycle- MemWINV- VGASnoop- ParErr+ Stepping- SERR+ FastB2B- DisINTx+
	Status: Cap+ 66MHz- UDF- FastB2B- ParErr- DEVSEL=fast >TAbort- <TAbort- <MAbort- >SERR- <PERR- INTx-
	Latency: 0, Cache Line Size: 32 bytes
	Interrupt: pin A routed to IRQ 18
	NUMA node: 0
	IOMMU group: 4
	Region 0: Memory at b6000000 (64-bit, prefetchable) [size=32M]
	Region 3: Memory at ba010000 (64-bit, prefetchable) [size=64K]
	Expansion ROM at bba00000 [disabled] [size=1M]
	Capabilities: [40] Power Management version 3
		Flags: PMEClk- DSI+ D1- D2- AuxCurrent=0mA PME(D0-,D1-,D2-,D3hot-,D3cold-)
		Status: D0 NoSoftRst+ PME-Enable- DSel=0 DScale=1 PME-
	Capabilities: [50] MSI: Enable- Count=1/1 Maskable+ 64bit+
		Address: 0000000000000000  Data: 0000
		Masking: 00000000  Pending: 00000000
	Capabilities: [70] MSI-X: Enable+ Count=1024 Masked-
		Vector table: BAR=3 offset=00000000
		PBA: BAR=3 offset=00008000
	Capabilities: [a0] Express (v2) Endpoint, MSI 00
		DevCap:	MaxPayload 512 bytes, PhantFunc 0, Latency L0s <512ns, L1 <64us
			ExtTag+ AttnBtn- AttnInd- PwrInd- RBE+ FLReset+ SlotPowerLimit 0W
		DevCtl:	CorrErr+ NonFatalErr+ FatalErr+ UnsupReq-
			RlxdOrd+ ExtTag+ PhantFunc- AuxPwr- NoSnoop- FLReset-
			MaxPayload 512 bytes, MaxReadReq 4096 bytes
		DevSta:	CorrErr+ NonFatalErr- FatalErr- UnsupReq+ AuxPwr+ TransPend-
		LnkCap:	Port #0, Speed 16GT/s, Width x8, ASPM not supported
			ClockPM- Surprise- LLActRep- BwNot- ASPMOptComp+
		LnkCtl:	ASPM Disabled; RCB 64 bytes, Disabled- CommClk+
			ExtSynch- ClockPM- AutWidDis- BWInt- AutBWInt-
		LnkSta:	Speed 16GT/s, Width x8
			TrErr- Train- SlotClk+ DLActive- BWMgmt- ABWMgmt-
		DevCap2: Completion Timeout: Range AB, TimeoutDis+ NROPrPrP- LTR-
			 10BitTagComp+ 10BitTagReq- OBFF Not Supported, ExtFmt+ EETLPPrefix+, MaxEETLPPrefixes 1
			 EmergencyPowerReduction Not Supported, EmergencyPowerReductionInit-
			 FRS- TPHComp- ExtTPHComp-
			 AtomicOpsCap: 32bit- 64bit- 128bitCAS-
		DevCtl2: Completion Timeout: 50us to 50ms, TimeoutDis- LTR- 10BitTagReq- OBFF Disabled,
			 AtomicOpsCtl: ReqEn-
		LnkCap2: Supported Link Speeds: 2.5-16GT/s, Crosslink- Retimer+ 2Retimers+ DRS-
		LnkCtl2: Target Link Speed: 16GT/s, EnterCompliance- SpeedDis-
			 Transmit Margin: Normal Operating Range, EnterModifiedCompliance- ComplianceSOS-
			 Compliance Preset/De-emphasis: -6dB de-emphasis, 0dB preshoot
		LnkSta2: Current De-emphasis Level: -3.5dB, EqualizationComplete+ EqualizationPhase1+
			 EqualizationPhase2+ EqualizationPhase3+ LinkEqualizationRequest-
			 Retimer- 2Retimers- CrosslinkRes: unsupported
	Capabilities: [e0] Vital Product Data
		Product Name: Cisco(R) Ethernet Network Adapter E810-XXVDA2
		Read-only fields:
			[V1] Vendor specific: Cisco(R) Ethernet Network Adapter E810-XXVDA2
			[PN] Part number: K92784-006
			[SN] Serial number: 303EA70AC6BE
			[V2] Vendor specific: 3123
			[RV] Reserved: checksum good, 0 byte(s) reserved
		End
	Capabilities: [100 v2] Advanced Error Reporting
		UESta:	DLP- SDES- TLP- FCP- CmpltTO- CmpltAbrt- UnxCmplt- RxOF- MalfTLP- ECRC- UnsupReq- ACSViol-
		UEMsk:	DLP- SDES- TLP- FCP- CmpltTO- CmpltAbrt- UnxCmplt- RxOF- MalfTLP- ECRC- UnsupReq+ ACSViol-
		UESvrt:	DLP+ SDES- TLP+ FCP+ CmpltTO- CmpltAbrt- UnxCmplt- RxOF+ MalfTLP+ ECRC- UnsupReq- ACSViol-
		CESta:	RxErr- BadTLP- BadDLLP- Rollover- Timeout- AdvNonFatalErr+
		CEMsk:	RxErr- BadTLP- BadDLLP- Rollover- Timeout- AdvNonFatalErr+
		AERCap:	First Error Pointer: 00, ECRCGenCap+ ECRCGenEn- ECRCChkCap+ ECRCChkEn-
			MultHdrRecCap- MultHdrRecEn- TLPPfxPres- HdrLogCap-
		HeaderLog: 00000000 00000000 00000000 00000000
	Capabilities: [148 v1] Alternative Routing-ID Interpretation (ARI)
		ARICap:	MFVC- ACS-, Next Function: 1
		ARICtl:	MFVC- ACS-, Function Group: 0
	Capabilities: [150 v1] Device Serial Number 30-3e-a7-ff-ff-0a-c6-be
	Capabilities: [160 v1] Single Root I/O Virtualization (SR-IOV)
		IOVCap:	Migration- 10BitTagReq- Interrupt Message Number: 000
		IOVCtl:	Enable- Migration- Interrupt- MSE- ARIHierarchy+ 10BitTagReq-
		IOVSta:	Migration-
		Initial VFs: 128, Total VFs: 128, Number of VFs: 0, Function Dependency Link: 00
		VF offset: 8, stride: 1, Device ID: 1889
		Supported Page Size: 00000553, System Page Size: 00000001
		Region 0: Memory at 00000000b9000000 (64-bit, prefetchable)
		Region 3: Memory at 00000000ba220000 (64-bit, prefetchable)
		VF Migration: offset: 00000000, BIR: 0
	Capabilities: [1a0 v1] Transaction Processing Hints
		Device specific mode supported
		No steering table available
	Capabilities: [1b0 v1] Access Control Services
		ACSCap:	SrcValid- TransBlk- ReqRedir- CmpltRedir- UpstreamFwd- EgressCtrl- DirectTrans-
		ACSCtl:	SrcValid- TransBlk- ReqRedir- CmpltRedir- UpstreamFwd- EgressCtrl- DirectTrans-
	Capabilities: [1d0 v1] Secondary PCI Express
		LnkCtl3: LnkEquIntrruptEn- PerformEqu-
		LaneErrStat: 0
	Capabilities: [200 v1] Data Link Feature <?>
	Capabilities: [210 v1] Physical Layer 16.0 GT/s <?>
	Capabilities: [250 v1] Lane Margining at the Receiver <?>
	Kernel driver in use: ice
	Kernel modules: ice


Collect lspci info for 4b:00.1
4b:00.1 Ethernet controller: Intel Corporation Ethernet Controller E810-XXV for SFP (rev 02)
	Subsystem: Cisco Systems Inc E810XXVDA2 2x25/10 GbE SFP28 PCIe NIC
	Physical Slot: 9
	Control: I/O- Mem+ BusMaster+ SpecCycle- MemWINV- VGASnoop- ParErr+ Stepping- SERR+ FastB2B- DisINTx+
	Status: Cap+ 66MHz- UDF- FastB2B- ParErr- DEVSEL=fast >TAbort- <TAbort- <MAbort- >SERR- <PERR- INTx-
	Latency: 0, Cache Line Size: 32 bytes
	Interrupt: pin A routed to IRQ 18
	NUMA node: 0
	IOMMU group: 5
	Region 0: Memory at b4000000 (64-bit, prefetchable) [size=32M]
	Region 3: Memory at ba000000 (64-bit, prefetchable) [size=64K]
	Expansion ROM at bb900000 [disabled] [size=1M]
	Capabilities: [40] Power Management version 3
		Flags: PMEClk- DSI+ D1- D2- AuxCurrent=0mA PME(D0-,D1-,D2-,D3hot-,D3cold-)
		Status: D0 NoSoftRst+ PME-Enable- DSel=0 DScale=1 PME-
	Capabilities: [50] MSI: Enable- Count=1/1 Maskable+ 64bit+
		Address: 0000000000000000  Data: 0000
		Masking: 00000000  Pending: 00000000
	Capabilities: [70] MSI-X: Enable+ Count=1024 Masked-
		Vector table: BAR=3 offset=00000000
		PBA: BAR=3 offset=00008000
	Capabilities: [a0] Express (v2) Endpoint, MSI 00
		DevCap:	MaxPayload 512 bytes, PhantFunc 0, Latency L0s <512ns, L1 <64us
			ExtTag+ AttnBtn- AttnInd- PwrInd- RBE+ FLReset+ SlotPowerLimit 0W
		DevCtl:	CorrErr+ NonFatalErr+ FatalErr+ UnsupReq-
			RlxdOrd+ ExtTag+ PhantFunc- AuxPwr- NoSnoop- FLReset-
			MaxPayload 512 bytes, MaxReadReq 4096 bytes
		DevSta:	CorrErr+ NonFatalErr- FatalErr- UnsupReq+ AuxPwr+ TransPend-
		LnkCap:	Port #0, Speed 16GT/s, Width x8, ASPM not supported
			ClockPM- Surprise- LLActRep- BwNot- ASPMOptComp+
		LnkCtl:	ASPM Disabled; RCB 64 bytes, Disabled- CommClk+
			ExtSynch- ClockPM- AutWidDis- BWInt- AutBWInt-
		LnkSta:	Speed 16GT/s, Width x8
			TrErr- Train- SlotClk+ DLActive- BWMgmt- ABWMgmt-
		DevCap2: Completion Timeout: Range AB, TimeoutDis+ NROPrPrP- LTR-
			 10BitTagComp+ 10BitTagReq- OBFF Not Supported, ExtFmt+ EETLPPrefix+, MaxEETLPPrefixes 1
			 EmergencyPowerReduction Not Supported, EmergencyPowerReductionInit-
			 FRS- TPHComp- ExtTPHComp-
			 AtomicOpsCap: 32bit- 64bit- 128bitCAS-
		DevCtl2: Completion Timeout: 50us to 50ms, TimeoutDis- LTR- 10BitTagReq- OBFF Disabled,
			 AtomicOpsCtl: ReqEn-
		LnkSta2: Current De-emphasis Level: -3.5dB, EqualizationComplete- EqualizationPhase1-
			 EqualizationPhase2- EqualizationPhase3- LinkEqualizationRequest-
			 Retimer- 2Retimers- CrosslinkRes: unsupported
	Capabilities: [e0] Vital Product Data
		Product Name: Cisco(R) Ethernet Network Adapter E810-XXVDA2
		Read-only fields:
			[V1] Vendor specific: Cisco(R) Ethernet Network Adapter E810-XXVDA2
			[PN] Part number: K92784-006
			[SN] Serial number: 303EA70AC6BE
			[V2] Vendor specific: 3123
			[RV] Reserved: checksum good, 0 byte(s) reserved
		End
	Capabilities: [100 v2] Advanced Error Reporting
		UESta:	DLP- SDES- TLP- FCP- CmpltTO- CmpltAbrt- UnxCmplt- RxOF- MalfTLP- ECRC- UnsupReq- ACSViol-
		UEMsk:	DLP- SDES- TLP- FCP- CmpltTO- CmpltAbrt- UnxCmplt- RxOF- MalfTLP- ECRC- UnsupReq+ ACSViol-
		UESvrt:	DLP+ SDES- TLP+ FCP+ CmpltTO- CmpltAbrt- UnxCmplt- RxOF+ MalfTLP+ ECRC- UnsupReq- ACSViol-
		CESta:	RxErr- BadTLP- BadDLLP- Rollover- Timeout- AdvNonFatalErr+
		CEMsk:	RxErr- BadTLP- BadDLLP- Rollover- Timeout- AdvNonFatalErr+
		AERCap:	First Error Pointer: 00, ECRCGenCap+ ECRCGenEn- ECRCChkCap+ ECRCChkEn-
			MultHdrRecCap- MultHdrRecEn- TLPPfxPres- HdrLogCap-
		HeaderLog: 00000000 00000000 00000000 00000000
	Capabilities: [148 v1] Alternative Routing-ID Interpretation (ARI)
		ARICap:	MFVC- ACS-, Next Function: 0
		ARICtl:	MFVC- ACS-, Function Group: 0
	Capabilities: [150 v1] Device Serial Number 30-3e-a7-ff-ff-0a-c6-be
	Capabilities: [160 v1] Single Root I/O Virtualization (SR-IOV)
		IOVCap:	Migration- 10BitTagReq- Interrupt Message Number: 000
		IOVCtl:	Enable- Migration- Interrupt- MSE- ARIHierarchy- 10BitTagReq-
		IOVSta:	Migration-
		Initial VFs: 128, Total VFs: 128, Number of VFs: 0, Function Dependency Link: 01
		VF offset: 135, stride: 1, Device ID: 1889
		Supported Page Size: 00000553, System Page Size: 00000001
		Region 0: Memory at 00000000b8000000 (64-bit, prefetchable)
		Region 3: Memory at 00000000ba020000 (64-bit, prefetchable)
		VF Migration: offset: 00000000, BIR: 0
	Capabilities: [1a0 v1] Transaction Processing Hints
		Device specific mode supported
		No steering table available
	Capabilities: [1b0 v1] Access Control Services
		ACSCap:	SrcValid- TransBlk- ReqRedir- CmpltRedir- UpstreamFwd- EgressCtrl- DirectTrans-
		ACSCtl:	SrcValid- TransBlk- ReqRedir- CmpltRedir- UpstreamFwd- EgressCtrl- DirectTrans-
	Capabilities: [200 v1] Data Link Feature <?>
	Kernel driver in use: ice
	Kernel modules: ice


Collect lspci info for b1:00.0
b1:00.0 Ethernet controller: Intel Corporation Ethernet Controller E810-XXV for SFP (rev 02)
	Subsystem: Cisco Systems Inc E810XXVDA2 2x25/10 GbE SFP28 PCIe NIC
	Physical Slot: 9-2
	Control: I/O- Mem+ BusMaster+ SpecCycle- MemWINV- VGASnoop- ParErr+ Stepping- SERR+ FastB2B- DisINTx+
	Status: Cap+ 66MHz- UDF- FastB2B- ParErr- DEVSEL=fast >TAbort- <TAbort- <MAbort- >SERR- <PERR- INTx-
	Latency: 0, Cache Line Size: 32 bytes
	Interrupt: pin A routed to IRQ 18
	NUMA node: 1
	IOMMU group: 17
	Region 0: Memory at e2000000 (64-bit, prefetchable) [size=32M]
	Region 3: Memory at e6010000 (64-bit, prefetchable) [size=64K]
	Expansion ROM at e6600000 [disabled] [size=1M]
	Capabilities: [40] Power Management version 3
		Flags: PMEClk- DSI+ D1- D2- AuxCurrent=0mA PME(D0-,D1-,D2-,D3hot-,D3cold-)
		Status: D0 NoSoftRst+ PME-Enable- DSel=0 DScale=1 PME-
	Capabilities: [50] MSI: Enable- Count=1/1 Maskable+ 64bit+
		Address: 0000000000000000  Data: 0000
		Masking: 00000000  Pending: 00000000
	Capabilities: [70] MSI-X: Enable+ Count=1024 Masked-
		Vector table: BAR=3 offset=00000000
		PBA: BAR=3 offset=00008000
	Capabilities: [a0] Express (v2) Endpoint, MSI 00
		DevCap:	MaxPayload 512 bytes, PhantFunc 0, Latency L0s <512ns, L1 <64us
			ExtTag+ AttnBtn- AttnInd- PwrInd- RBE+ FLReset+ SlotPowerLimit 0W
		DevCtl:	CorrErr+ NonFatalErr+ FatalErr+ UnsupReq-
			RlxdOrd+ ExtTag+ PhantFunc- AuxPwr- NoSnoop- FLReset-
			MaxPayload 512 bytes, MaxReadReq 4096 bytes
		DevSta:	CorrErr+ NonFatalErr- FatalErr- UnsupReq+ AuxPwr+ TransPend-
		LnkCap:	Port #0, Speed 16GT/s, Width x8, ASPM not supported
			ClockPM- Surprise- LLActRep- BwNot- ASPMOptComp+
		LnkCtl:	ASPM Disabled; RCB 64 bytes, Disabled- CommClk+
			ExtSynch- ClockPM- AutWidDis- BWInt- AutBWInt-
		LnkSta:	Speed 16GT/s, Width x8
			TrErr- Train- SlotClk+ DLActive- BWMgmt- ABWMgmt-
		DevCap2: Completion Timeout: Range AB, TimeoutDis+ NROPrPrP- LTR-
			 10BitTagComp+ 10BitTagReq- OBFF Not Supported, ExtFmt+ EETLPPrefix+, MaxEETLPPrefixes 1
			 EmergencyPowerReduction Not Supported, EmergencyPowerReductionInit-
			 FRS- TPHComp- ExtTPHComp-
			 AtomicOpsCap: 32bit- 64bit- 128bitCAS-
		DevCtl2: Completion Timeout: 50us to 50ms, TimeoutDis- LTR- 10BitTagReq- OBFF Disabled,
			 AtomicOpsCtl: ReqEn-
		LnkCap2: Supported Link Speeds: 2.5-16GT/s, Crosslink- Retimer+ 2Retimers+ DRS-
		LnkCtl2: Target Link Speed: 16GT/s, EnterCompliance- SpeedDis-
			 Transmit Margin: Normal Operating Range, EnterModifiedCompliance- ComplianceSOS-
			 Compliance Preset/De-emphasis: -6dB de-emphasis, 0dB preshoot
		LnkSta2: Current De-emphasis Level: -3.5dB, EqualizationComplete+ EqualizationPhase1+
			 EqualizationPhase2+ EqualizationPhase3+ LinkEqualizationRequest-
			 Retimer- 2Retimers- CrosslinkRes: unsupported
	Capabilities: [e0] Vital Product Data
		Product Name: Cisco(R) Ethernet Network Adapter E810-XXVDA2
		Read-only fields:
			[V1] Vendor specific: Cisco(R) Ethernet Network Adapter E810-XXVDA2
			[PN] Part number: K92784-006
			[SN] Serial number: 303EA70ACA14
			[V2] Vendor specific: 3123
			[RV] Reserved: checksum good, 0 byte(s) reserved
		End
	Capabilities: [100 v2] Advanced Error Reporting
		UESta:	DLP- SDES- TLP- FCP- CmpltTO- CmpltAbrt- UnxCmplt- RxOF- MalfTLP- ECRC- UnsupReq- ACSViol-
		UEMsk:	DLP- SDES- TLP- FCP- CmpltTO- CmpltAbrt- UnxCmplt- RxOF- MalfTLP- ECRC- UnsupReq+ ACSViol-
		UESvrt:	DLP+ SDES- TLP+ FCP+ CmpltTO- CmpltAbrt- UnxCmplt- RxOF+ MalfTLP+ ECRC- UnsupReq- ACSViol-
		CESta:	RxErr- BadTLP- BadDLLP- Rollover- Timeout- AdvNonFatalErr+
		CEMsk:	RxErr- BadTLP- BadDLLP- Rollover- Timeout- AdvNonFatalErr+
		AERCap:	First Error Pointer: 00, ECRCGenCap+ ECRCGenEn- ECRCChkCap+ ECRCChkEn-
			MultHdrRecCap- MultHdrRecEn- TLPPfxPres- HdrLogCap-
		HeaderLog: 00000000 00000000 00000000 00000000
	Capabilities: [148 v1] Alternative Routing-ID Interpretation (ARI)
		ARICap:	MFVC- ACS-, Next Function: 1
		ARICtl:	MFVC- ACS-, Function Group: 0
	Capabilities: [150 v1] Device Serial Number 30-3e-a7-ff-ff-0a-ca-14
	Capabilities: [160 v1] Single Root I/O Virtualization (SR-IOV)
		IOVCap:	Migration- 10BitTagReq- Interrupt Message Number: 000
		IOVCtl:	Enable+ Migration- Interrupt- MSE+ ARIHierarchy+ 10BitTagReq-
		IOVSta:	Migration-
		Initial VFs: 128, Total VFs: 128, Number of VFs: 6, Function Dependency Link: 00
		VF offset: 8, stride: 1, Device ID: 1889
		Supported Page Size: 00000553, System Page Size: 00000001
		Region 0: Memory at 00000000e5000000 (64-bit, prefetchable)
		Region 3: Memory at 00000000e6220000 (64-bit, prefetchable)
		VF Migration: offset: 00000000, BIR: 0
	Capabilities: [1a0 v1] Transaction Processing Hints
		Device specific mode supported
		No steering table available
	Capabilities: [1b0 v1] Access Control Services
		ACSCap:	SrcValid- TransBlk- ReqRedir- CmpltRedir- UpstreamFwd- EgressCtrl- DirectTrans-
		ACSCtl:	SrcValid- TransBlk- ReqRedir- CmpltRedir- UpstreamFwd- EgressCtrl- DirectTrans-
	Capabilities: [1d0 v1] Secondary PCI Express
		LnkCtl3: LnkEquIntrruptEn- PerformEqu-
		LaneErrStat: 0
	Capabilities: [200 v1] Data Link Feature <?>
	Capabilities: [210 v1] Physical Layer 16.0 GT/s <?>
	Capabilities: [250 v1] Lane Margining at the Receiver <?>
	Kernel driver in use: ice
	Kernel modules: ice


Collect lspci info for b1:00.1
b1:00.1 Ethernet controller: Intel Corporation Ethernet Controller E810-XXV for SFP (rev 02)
	Subsystem: Cisco Systems Inc E810XXVDA2 2x25/10 GbE SFP28 PCIe NIC
	Physical Slot: 9-2
	Control: I/O- Mem+ BusMaster+ SpecCycle- MemWINV- VGASnoop- ParErr+ Stepping- SERR+ FastB2B- DisINTx+
	Status: Cap+ 66MHz- UDF- FastB2B- ParErr- DEVSEL=fast >TAbort- <TAbort- <MAbort- >SERR- <PERR- INTx-
	Latency: 0, Cache Line Size: 32 bytes
	Interrupt: pin A routed to IRQ 18
	NUMA node: 1
	IOMMU group: 18
	Region 0: Memory at e0000000 (64-bit, prefetchable) [size=32M]
	Region 3: Memory at e6000000 (64-bit, prefetchable) [size=64K]
	Expansion ROM at e6500000 [disabled] [size=1M]
	Capabilities: [40] Power Management version 3
		Flags: PMEClk- DSI+ D1- D2- AuxCurrent=0mA PME(D0-,D1-,D2-,D3hot-,D3cold-)
		Status: D0 NoSoftRst+ PME-Enable- DSel=0 DScale=1 PME-
	Capabilities: [50] MSI: Enable- Count=1/1 Maskable+ 64bit+
		Address: 0000000000000000  Data: 0000
		Masking: 00000000  Pending: 00000000
	Capabilities: [70] MSI-X: Enable+ Count=1024 Masked-
		Vector table: BAR=3 offset=00000000
		PBA: BAR=3 offset=00008000
	Capabilities: [a0] Express (v2) Endpoint, MSI 00
		DevCap:	MaxPayload 512 bytes, PhantFunc 0, Latency L0s <512ns, L1 <64us
			ExtTag+ AttnBtn- AttnInd- PwrInd- RBE+ FLReset+ SlotPowerLimit 0W
		DevCtl:	CorrErr+ NonFatalErr+ FatalErr+ UnsupReq-
			RlxdOrd+ ExtTag+ PhantFunc- AuxPwr- NoSnoop- FLReset-
			MaxPayload 512 bytes, MaxReadReq 4096 bytes
		DevSta:	CorrErr+ NonFatalErr- FatalErr- UnsupReq+ AuxPwr+ TransPend-
		LnkCap:	Port #0, Speed 16GT/s, Width x8, ASPM not supported
			ClockPM- Surprise- LLActRep- BwNot- ASPMOptComp+
		LnkCtl:	ASPM Disabled; RCB 64 bytes, Disabled- CommClk+
			ExtSynch- ClockPM- AutWidDis- BWInt- AutBWInt-
		LnkSta:	Speed 16GT/s, Width x8
			TrErr- Train- SlotClk+ DLActive- BWMgmt- ABWMgmt-
		DevCap2: Completion Timeout: Range AB, TimeoutDis+ NROPrPrP- LTR-
			 10BitTagComp+ 10BitTagReq- OBFF Not Supported, ExtFmt+ EETLPPrefix+, MaxEETLPPrefixes 1
			 EmergencyPowerReduction Not Supported, EmergencyPowerReductionInit-
			 FRS- TPHComp- ExtTPHComp-
			 AtomicOpsCap: 32bit- 64bit- 128bitCAS-
		DevCtl2: Completion Timeout: 50us to 50ms, TimeoutDis- LTR- 10BitTagReq- OBFF Disabled,
			 AtomicOpsCtl: ReqEn-
		LnkSta2: Current De-emphasis Level: -3.5dB, EqualizationComplete- EqualizationPhase1-
			 EqualizationPhase2- EqualizationPhase3- LinkEqualizationRequest-
			 Retimer- 2Retimers- CrosslinkRes: unsupported
	Capabilities: [e0] Vital Product Data
		Product Name: Cisco(R) Ethernet Network Adapter E810-XXVDA2
		Read-only fields:
			[V1] Vendor specific: Cisco(R) Ethernet Network Adapter E810-XXVDA2
			[PN] Part number: K92784-006
			[SN] Serial number: 303EA70ACA14
			[V2] Vendor specific: 3123
			[RV] Reserved: checksum good, 0 byte(s) reserved
		End
	Capabilities: [100 v2] Advanced Error Reporting
		UESta:	DLP- SDES- TLP- FCP- CmpltTO- CmpltAbrt- UnxCmplt- RxOF- MalfTLP- ECRC- UnsupReq- ACSViol-
		UEMsk:	DLP- SDES- TLP- FCP- CmpltTO- CmpltAbrt- UnxCmplt- RxOF- MalfTLP- ECRC- UnsupReq+ ACSViol-
		UESvrt:	DLP+ SDES- TLP+ FCP+ CmpltTO- CmpltAbrt- UnxCmplt- RxOF+ MalfTLP+ ECRC- UnsupReq- ACSViol-
		CESta:	RxErr- BadTLP- BadDLLP- Rollover- Timeout- AdvNonFatalErr+
		CEMsk:	RxErr- BadTLP- BadDLLP- Rollover- Timeout- AdvNonFatalErr+
		AERCap:	First Error Pointer: 00, ECRCGenCap+ ECRCGenEn- ECRCChkCap+ ECRCChkEn-
			MultHdrRecCap- MultHdrRecEn- TLPPfxPres- HdrLogCap-
		HeaderLog: 00000000 00000000 00000000 00000000
	Capabilities: [148 v1] Alternative Routing-ID Interpretation (ARI)
		ARICap:	MFVC- ACS-, Next Function: 0
		ARICtl:	MFVC- ACS-, Function Group: 0
	Capabilities: [150 v1] Device Serial Number 30-3e-a7-ff-ff-0a-ca-14
	Capabilities: [160 v1] Single Root I/O Virtualization (SR-IOV)
		IOVCap:	Migration- 10BitTagReq- Interrupt Message Number: 000
		IOVCtl:	Enable- Migration- Interrupt- MSE- ARIHierarchy- 10BitTagReq-
		IOVSta:	Migration-
		Initial VFs: 128, Total VFs: 128, Number of VFs: 0, Function Dependency Link: 01
		VF offset: 135, stride: 1, Device ID: 1889
		Supported Page Size: 00000553, System Page Size: 00000001
		Region 0: Memory at 00000000e4000000 (64-bit, prefetchable)
		Region 3: Memory at 00000000e6020000 (64-bit, prefetchable)
		VF Migration: offset: 00000000, BIR: 0
	Capabilities: [1a0 v1] Transaction Processing Hints
		Device specific mode supported
		No steering table available
	Capabilities: [1b0 v1] Access Control Services
		ACSCap:	SrcValid- TransBlk- ReqRedir- CmpltRedir- UpstreamFwd- EgressCtrl- DirectTrans-
		ACSCtl:	SrcValid- TransBlk- ReqRedir- CmpltRedir- UpstreamFwd- EgressCtrl- DirectTrans-
	Capabilities: [200 v1] Data Link Feature <?>
	Kernel driver in use: ice
	Kernel modules: ice


Collect lspci info for b1:01.0
b1:01.0 Ethernet controller: Intel Corporation Ethernet Adaptive Virtual Function (rev 02)
	Subsystem: Cisco Systems Inc Ethernet Adaptive Virtual Function
	Control: I/O- Mem- BusMaster- SpecCycle- MemWINV- VGASnoop- ParErr- Stepping- SERR- FastB2B- DisINTx-
	Status: Cap+ 66MHz- UDF- FastB2B- ParErr- DEVSEL=fast >TAbort- <TAbort- <MAbort- >SERR- <PERR- INTx-
	NUMA node: 1
	IOMMU group: 258
	Region 0: Memory at e5000000 (64-bit, prefetchable) [virtual] [size=128K]
	Region 3: Memory at e6220000 (64-bit, prefetchable) [virtual] [size=16K]
	Capabilities: [70] MSI-X: Enable- Count=65 Masked-
		Vector table: BAR=3 offset=00000000
		PBA: BAR=3 offset=00002000
	Capabilities: [a0] Express (v2) Endpoint, MSI 00
		DevCap:	MaxPayload 512 bytes, PhantFunc 0, Latency L0s <512ns, L1 <64us
			ExtTag+ AttnBtn- AttnInd- PwrInd- RBE+ FLReset+ SlotPowerLimit 0W
		DevCtl:	CorrErr- NonFatalErr- FatalErr- UnsupReq-
			RlxdOrd- ExtTag- PhantFunc- AuxPwr- NoSnoop- FLReset-
			MaxPayload 128 bytes, MaxReadReq 128 bytes
		DevSta:	CorrErr- NonFatalErr- FatalErr- UnsupReq- AuxPwr- TransPend-
		LnkCap:	Port #0, Speed 16GT/s, Width x8, ASPM not supported
			ClockPM- Surprise- LLActRep- BwNot- ASPMOptComp+
		LnkCtl:	ASPM Disabled; RCB 64 bytes, Disabled- CommClk-
			ExtSynch- ClockPM- AutWidDis- BWInt- AutBWInt-
		LnkSta:	Speed unknown (downgraded), Width x0 (downgraded)
			TrErr- Train- SlotClk- DLActive- BWMgmt- ABWMgmt-
		DevCap2: Completion Timeout: Range AB, TimeoutDis+ NROPrPrP- LTR-
			 10BitTagComp+ 10BitTagReq- OBFF Not Supported, ExtFmt- EETLPPrefix-
			 EmergencyPowerReduction Not Supported, EmergencyPowerReductionInit-
			 FRS- TPHComp- ExtTPHComp-
			 AtomicOpsCap: 32bit- 64bit- 128bitCAS-
		DevCtl2: Completion Timeout: 50us to 50ms, TimeoutDis- LTR- 10BitTagReq- OBFF Disabled,
			 AtomicOpsCtl: ReqEn-
		LnkSta2: Current De-emphasis Level: -6dB, EqualizationComplete- EqualizationPhase1-
			 EqualizationPhase2- EqualizationPhase3- LinkEqualizationRequest-
			 Retimer- 2Retimers- CrosslinkRes: unsupported
	Capabilities: [100 v2] Advanced Error Reporting
		UESta:	DLP- SDES- TLP- FCP- CmpltTO- CmpltAbrt- UnxCmplt- RxOF- MalfTLP- ECRC- UnsupReq- ACSViol-
		UEMsk:	DLP- SDES- TLP- FCP- CmpltTO- CmpltAbrt- UnxCmplt- RxOF- MalfTLP- ECRC- UnsupReq- ACSViol-
		UESvrt:	DLP- SDES- TLP- FCP- CmpltTO- CmpltAbrt- UnxCmplt- RxOF- MalfTLP- ECRC- UnsupReq- ACSViol-
		CESta:	RxErr- BadTLP- BadDLLP- Rollover- Timeout- AdvNonFatalErr-
		CEMsk:	RxErr- BadTLP- BadDLLP- Rollover- Timeout- AdvNonFatalErr-
		AERCap:	First Error Pointer: 00, ECRCGenCap+ ECRCGenEn- ECRCChkCap+ ECRCChkEn-
			MultHdrRecCap- MultHdrRecEn- TLPPfxPres- HdrLogCap-
		HeaderLog: 00000000 00000000 00000000 00000000
	Capabilities: [148 v1] Alternative Routing-ID Interpretation (ARI)
		ARICap:	MFVC- ACS-, Next Function: 0
		ARICtl:	MFVC- ACS-, Function Group: 0
	Capabilities: [1a0 v1] Transaction Processing Hints
		Device specific mode supported
		No steering table available
	Capabilities: [1d0 v1] Access Control Services
		ACSCap:	SrcValid- TransBlk- ReqRedir- CmpltRedir- UpstreamFwd- EgressCtrl- DirectTrans-
		ACSCtl:	SrcValid- TransBlk- ReqRedir- CmpltRedir- UpstreamFwd- EgressCtrl- DirectTrans-
	Kernel driver in use: vfio-pci
	Kernel modules: iavf


Collect lspci info for b1:01.1
b1:01.1 Ethernet controller: Intel Corporation Ethernet Adaptive Virtual Function (rev 02)
	Subsystem: Cisco Systems Inc Ethernet Adaptive Virtual Function
	Control: I/O- Mem- BusMaster- SpecCycle- MemWINV- VGASnoop- ParErr- Stepping- SERR- FastB2B- DisINTx-
	Status: Cap+ 66MHz- UDF- FastB2B- ParErr- DEVSEL=fast >TAbort- <TAbort- <MAbort- >SERR- <PERR- INTx-
	NUMA node: 1
	IOMMU group: 259
	Region 0: Memory at e5020000 (64-bit, prefetchable) [virtual] [size=128K]
	Region 3: Memory at e6224000 (64-bit, prefetchable) [virtual] [size=16K]
	Capabilities: [70] MSI-X: Enable- Count=65 Masked-
		Vector table: BAR=3 offset=00000000
		PBA: BAR=3 offset=00002000
	Capabilities: [a0] Express (v2) Endpoint, MSI 00
		DevCap:	MaxPayload 512 bytes, PhantFunc 0, Latency L0s <512ns, L1 <64us
			ExtTag+ AttnBtn- AttnInd- PwrInd- RBE+ FLReset+ SlotPowerLimit 0W
		DevCtl:	CorrErr- NonFatalErr- FatalErr- UnsupReq-
			RlxdOrd- ExtTag- PhantFunc- AuxPwr- NoSnoop- FLReset-
			MaxPayload 128 bytes, MaxReadReq 128 bytes
		DevSta:	CorrErr- NonFatalErr- FatalErr- UnsupReq- AuxPwr- TransPend-
		LnkCap:	Port #0, Speed 16GT/s, Width x8, ASPM not supported
			ClockPM- Surprise- LLActRep- BwNot- ASPMOptComp+
		LnkCtl:	ASPM Disabled; RCB 64 bytes, Disabled- CommClk-
			ExtSynch- ClockPM- AutWidDis- BWInt- AutBWInt-
		LnkSta:	Speed unknown (downgraded), Width x0 (downgraded)
			TrErr- Train- SlotClk- DLActive- BWMgmt- ABWMgmt-
		DevCap2: Completion Timeout: Range AB, TimeoutDis+ NROPrPrP- LTR-
			 10BitTagComp+ 10BitTagReq- OBFF Not Supported, ExtFmt- EETLPPrefix-
			 EmergencyPowerReduction Not Supported, EmergencyPowerReductionInit-
			 FRS- TPHComp- ExtTPHComp-
			 AtomicOpsCap: 32bit- 64bit- 128bitCAS-
		DevCtl2: Completion Timeout: 50us to 50ms, TimeoutDis- LTR- 10BitTagReq- OBFF Disabled,
			 AtomicOpsCtl: ReqEn-
		LnkSta2: Current De-emphasis Level: -6dB, EqualizationComplete- EqualizationPhase1-
			 EqualizationPhase2- EqualizationPhase3- LinkEqualizationRequest-
			 Retimer- 2Retimers- CrosslinkRes: unsupported
	Capabilities: [100 v2] Advanced Error Reporting
		UESta:	DLP- SDES- TLP- FCP- CmpltTO- CmpltAbrt- UnxCmplt- RxOF- MalfTLP- ECRC- UnsupReq- ACSViol-
		UEMsk:	DLP- SDES- TLP- FCP- CmpltTO- CmpltAbrt- UnxCmplt- RxOF- MalfTLP- ECRC- UnsupReq- ACSViol-
		UESvrt:	DLP- SDES- TLP- FCP- CmpltTO- CmpltAbrt- UnxCmplt- RxOF- MalfTLP- ECRC- UnsupReq- ACSViol-
		CESta:	RxErr- BadTLP- BadDLLP- Rollover- Timeout- AdvNonFatalErr-
		CEMsk:	RxErr- BadTLP- BadDLLP- Rollover- Timeout- AdvNonFatalErr-
		AERCap:	First Error Pointer: 00, ECRCGenCap+ ECRCGenEn- ECRCChkCap+ ECRCChkEn-
			MultHdrRecCap- MultHdrRecEn- TLPPfxPres- HdrLogCap-
		HeaderLog: 00000000 00000000 00000000 00000000
	Capabilities: [148 v1] Alternative Routing-ID Interpretation (ARI)
		ARICap:	MFVC- ACS-, Next Function: 0
		ARICtl:	MFVC- ACS-, Function Group: 0
	Capabilities: [1a0 v1] Transaction Processing Hints
		Device specific mode supported
		No steering table available
	Capabilities: [1d0 v1] Access Control Services
		ACSCap:	SrcValid- TransBlk- ReqRedir- CmpltRedir- UpstreamFwd- EgressCtrl- DirectTrans-
		ACSCtl:	SrcValid- TransBlk- ReqRedir- CmpltRedir- UpstreamFwd- EgressCtrl- DirectTrans-
	Kernel driver in use: vfio-pci
	Kernel modules: iavf


Collect lspci info for b1:01.2
b1:01.2 Ethernet controller: Intel Corporation Ethernet Adaptive Virtual Function (rev 02)
	Subsystem: Cisco Systems Inc Ethernet Adaptive Virtual Function
	Control: I/O- Mem- BusMaster- SpecCycle- MemWINV- VGASnoop- ParErr- Stepping- SERR- FastB2B- DisINTx-
	Status: Cap+ 66MHz- UDF- FastB2B- ParErr- DEVSEL=fast >TAbort- <TAbort- <MAbort- >SERR- <PERR- INTx-
	NUMA node: 1
	IOMMU group: 260
	Region 0: Memory at e5040000 (64-bit, prefetchable) [virtual] [size=128K]
	Region 3: Memory at e6228000 (64-bit, prefetchable) [virtual] [size=16K]
	Capabilities: [70] MSI-X: Enable- Count=65 Masked-
		Vector table: BAR=3 offset=00000000
		PBA: BAR=3 offset=00002000
	Capabilities: [a0] Express (v2) Endpoint, MSI 00
		DevCap:	MaxPayload 512 bytes, PhantFunc 0, Latency L0s <512ns, L1 <64us
			ExtTag+ AttnBtn- AttnInd- PwrInd- RBE+ FLReset+ SlotPowerLimit 0W
		DevCtl:	CorrErr- NonFatalErr- FatalErr- UnsupReq-
			RlxdOrd- ExtTag- PhantFunc- AuxPwr- NoSnoop- FLReset-
			MaxPayload 128 bytes, MaxReadReq 128 bytes
		DevSta:	CorrErr- NonFatalErr- FatalErr- UnsupReq- AuxPwr- TransPend-
		LnkCap:	Port #0, Speed 16GT/s, Width x8, ASPM not supported
			ClockPM- Surprise- LLActRep- BwNot- ASPMOptComp+
		LnkCtl:	ASPM Disabled; RCB 64 bytes, Disabled- CommClk-
			ExtSynch- ClockPM- AutWidDis- BWInt- AutBWInt-
		LnkSta:	Speed unknown (downgraded), Width x0 (downgraded)
			TrErr- Train- SlotClk- DLActive- BWMgmt- ABWMgmt-
		DevCap2: Completion Timeout: Range AB, TimeoutDis+ NROPrPrP- LTR-
			 10BitTagComp+ 10BitTagReq- OBFF Not Supported, ExtFmt- EETLPPrefix-
			 EmergencyPowerReduction Not Supported, EmergencyPowerReductionInit-
			 FRS- TPHComp- ExtTPHComp-
			 AtomicOpsCap: 32bit- 64bit- 128bitCAS-
		DevCtl2: Completion Timeout: 50us to 50ms, TimeoutDis- LTR- 10BitTagReq- OBFF Disabled,
			 AtomicOpsCtl: ReqEn-
		LnkSta2: Current De-emphasis Level: -6dB, EqualizationComplete- EqualizationPhase1-
			 EqualizationPhase2- EqualizationPhase3- LinkEqualizationRequest-
			 Retimer- 2Retimers- CrosslinkRes: unsupported
	Capabilities: [100 v2] Advanced Error Reporting
		UESta:	DLP- SDES- TLP- FCP- CmpltTO- CmpltAbrt- UnxCmplt- RxOF- MalfTLP- ECRC- UnsupReq- ACSViol-
		UEMsk:	DLP- SDES- TLP- FCP- CmpltTO- CmpltAbrt- UnxCmplt- RxOF- MalfTLP- ECRC- UnsupReq- ACSViol-
		UESvrt:	DLP- SDES- TLP- FCP- CmpltTO- CmpltAbrt- UnxCmplt- RxOF- MalfTLP- ECRC- UnsupReq- ACSViol-
		CESta:	RxErr- BadTLP- BadDLLP- Rollover- Timeout- AdvNonFatalErr-
		CEMsk:	RxErr- BadTLP- BadDLLP- Rollover- Timeout- AdvNonFatalErr-
		AERCap:	First Error Pointer: 00, ECRCGenCap+ ECRCGenEn- ECRCChkCap+ ECRCChkEn-
			MultHdrRecCap- MultHdrRecEn- TLPPfxPres- HdrLogCap-
		HeaderLog: 00000000 00000000 00000000 00000000
	Capabilities: [148 v1] Alternative Routing-ID Interpretation (ARI)
		ARICap:	MFVC- ACS-, Next Function: 0
		ARICtl:	MFVC- ACS-, Function Group: 0
	Capabilities: [1a0 v1] Transaction Processing Hints
		Device specific mode supported
		No steering table available
	Capabilities: [1d0 v1] Access Control Services
		ACSCap:	SrcValid- TransBlk- ReqRedir- CmpltRedir- UpstreamFwd- EgressCtrl- DirectTrans-
		ACSCtl:	SrcValid- TransBlk- ReqRedir- CmpltRedir- UpstreamFwd- EgressCtrl- DirectTrans-
	Kernel driver in use: vfio-pci
	Kernel modules: iavf


Collect lspci info for b1:01.3
b1:01.3 Ethernet controller: Intel Corporation Ethernet Adaptive Virtual Function (rev 02)
	Subsystem: Cisco Systems Inc Ethernet Adaptive Virtual Function
	Control: I/O- Mem- BusMaster- SpecCycle- MemWINV- VGASnoop- ParErr- Stepping- SERR- FastB2B- DisINTx-
	Status: Cap+ 66MHz- UDF- FastB2B- ParErr- DEVSEL=fast >TAbort- <TAbort- <MAbort- >SERR- <PERR- INTx-
	NUMA node: 1
	IOMMU group: 261
	Region 0: Memory at e5060000 (64-bit, prefetchable) [virtual] [size=128K]
	Region 3: Memory at e622c000 (64-bit, prefetchable) [virtual] [size=16K]
	Capabilities: [70] MSI-X: Enable- Count=65 Masked-
		Vector table: BAR=3 offset=00000000
		PBA: BAR=3 offset=00002000
	Capabilities: [a0] Express (v2) Endpoint, MSI 00
		DevCap:	MaxPayload 512 bytes, PhantFunc 0, Latency L0s <512ns, L1 <64us
			ExtTag+ AttnBtn- AttnInd- PwrInd- RBE+ FLReset+ SlotPowerLimit 0W
		DevCtl:	CorrErr- NonFatalErr- FatalErr- UnsupReq-
			RlxdOrd- ExtTag- PhantFunc- AuxPwr- NoSnoop- FLReset-
			MaxPayload 128 bytes, MaxReadReq 128 bytes
		DevSta:	CorrErr- NonFatalErr- FatalErr- UnsupReq- AuxPwr- TransPend-
		LnkCap:	Port #0, Speed 16GT/s, Width x8, ASPM not supported
			ClockPM- Surprise- LLActRep- BwNot- ASPMOptComp+
		LnkCtl:	ASPM Disabled; RCB 64 bytes, Disabled- CommClk-
			ExtSynch- ClockPM- AutWidDis- BWInt- AutBWInt-
		LnkSta:	Speed unknown (downgraded), Width x0 (downgraded)
			TrErr- Train- SlotClk- DLActive- BWMgmt- ABWMgmt-
		DevCap2: Completion Timeout: Range AB, TimeoutDis+ NROPrPrP- LTR-
			 10BitTagComp+ 10BitTagReq- OBFF Not Supported, ExtFmt- EETLPPrefix-
			 EmergencyPowerReduction Not Supported, EmergencyPowerReductionInit-
			 FRS- TPHComp- ExtTPHComp-
			 AtomicOpsCap: 32bit- 64bit- 128bitCAS-
		DevCtl2: Completion Timeout: 50us to 50ms, TimeoutDis- LTR- 10BitTagReq- OBFF Disabled,
			 AtomicOpsCtl: ReqEn-
		LnkSta2: Current De-emphasis Level: -6dB, EqualizationComplete- EqualizationPhase1-
			 EqualizationPhase2- EqualizationPhase3- LinkEqualizationRequest-
			 Retimer- 2Retimers- CrosslinkRes: unsupported
	Capabilities: [100 v2] Advanced Error Reporting
		UESta:	DLP- SDES- TLP- FCP- CmpltTO- CmpltAbrt- UnxCmplt- RxOF- MalfTLP- ECRC- UnsupReq- ACSViol-
		UEMsk:	DLP- SDES- TLP- FCP- CmpltTO- CmpltAbrt- UnxCmplt- RxOF- MalfTLP- ECRC- UnsupReq- ACSViol-
		UESvrt:	DLP- SDES- TLP- FCP- CmpltTO- CmpltAbrt- UnxCmplt- RxOF- MalfTLP- ECRC- UnsupReq- ACSViol-
		CESta:	RxErr- BadTLP- BadDLLP- Rollover- Timeout- AdvNonFatalErr-
		CEMsk:	RxErr- BadTLP- BadDLLP- Rollover- Timeout- AdvNonFatalErr-
		AERCap:	First Error Pointer: 00, ECRCGenCap+ ECRCGenEn- ECRCChkCap+ ECRCChkEn-
			MultHdrRecCap- MultHdrRecEn- TLPPfxPres- HdrLogCap-
		HeaderLog: 00000000 00000000 00000000 00000000
	Capabilities: [148 v1] Alternative Routing-ID Interpretation (ARI)
		ARICap:	MFVC- ACS-, Next Function: 0
		ARICtl:	MFVC- ACS-, Function Group: 0
	Capabilities: [1a0 v1] Transaction Processing Hints
		Device specific mode supported
		No steering table available
	Capabilities: [1d0 v1] Access Control Services
		ACSCap:	SrcValid- TransBlk- ReqRedir- CmpltRedir- UpstreamFwd- EgressCtrl- DirectTrans-
		ACSCtl:	SrcValid- TransBlk- ReqRedir- CmpltRedir- UpstreamFwd- EgressCtrl- DirectTrans-
	Kernel driver in use: vfio-pci
	Kernel modules: iavf


Collect lspci info for b1:01.4
b1:01.4 Ethernet controller: Intel Corporation Ethernet Adaptive Virtual Function (rev 02)
	Subsystem: Cisco Systems Inc Ethernet Adaptive Virtual Function
	Control: I/O- Mem- BusMaster- SpecCycle- MemWINV- VGASnoop- ParErr- Stepping- SERR- FastB2B- DisINTx-
	Status: Cap+ 66MHz- UDF- FastB2B- ParErr- DEVSEL=fast >TAbort- <TAbort- <MAbort- >SERR- <PERR- INTx-
	NUMA node: 1
	IOMMU group: 262
	Region 0: Memory at e5080000 (64-bit, prefetchable) [virtual] [size=128K]
	Region 3: Memory at e6230000 (64-bit, prefetchable) [virtual] [size=16K]
	Capabilities: [70] MSI-X: Enable- Count=65 Masked-
		Vector table: BAR=3 offset=00000000
		PBA: BAR=3 offset=00002000
	Capabilities: [a0] Express (v2) Endpoint, MSI 00
		DevCap:	MaxPayload 512 bytes, PhantFunc 0, Latency L0s <512ns, L1 <64us
			ExtTag+ AttnBtn- AttnInd- PwrInd- RBE+ FLReset+ SlotPowerLimit 0W
		DevCtl:	CorrErr- NonFatalErr- FatalErr- UnsupReq-
			RlxdOrd- ExtTag- PhantFunc- AuxPwr- NoSnoop- FLReset-
			MaxPayload 128 bytes, MaxReadReq 128 bytes
		DevSta:	CorrErr- NonFatalErr- FatalErr- UnsupReq- AuxPwr- TransPend-
		LnkCap:	Port #0, Speed 16GT/s, Width x8, ASPM not supported
			ClockPM- Surprise- LLActRep- BwNot- ASPMOptComp+
		LnkCtl:	ASPM Disabled; RCB 64 bytes, Disabled- CommClk-
			ExtSynch- ClockPM- AutWidDis- BWInt- AutBWInt-
		LnkSta:	Speed unknown (downgraded), Width x0 (downgraded)
			TrErr- Train- SlotClk- DLActive- BWMgmt- ABWMgmt-
		DevCap2: Completion Timeout: Range AB, TimeoutDis+ NROPrPrP- LTR-
			 10BitTagComp+ 10BitTagReq- OBFF Not Supported, ExtFmt- EETLPPrefix-
			 EmergencyPowerReduction Not Supported, EmergencyPowerReductionInit-
			 FRS- TPHComp- ExtTPHComp-
			 AtomicOpsCap: 32bit- 64bit- 128bitCAS-
		DevCtl2: Completion Timeout: 50us to 50ms, TimeoutDis- LTR- 10BitTagReq- OBFF Disabled,
			 AtomicOpsCtl: ReqEn-
		LnkSta2: Current De-emphasis Level: -6dB, EqualizationComplete- EqualizationPhase1-
			 EqualizationPhase2- EqualizationPhase3- LinkEqualizationRequest-
			 Retimer- 2Retimers- CrosslinkRes: unsupported
	Capabilities: [100 v2] Advanced Error Reporting
		UESta:	DLP- SDES- TLP- FCP- CmpltTO- CmpltAbrt- UnxCmplt- RxOF- MalfTLP- ECRC- UnsupReq- ACSViol-
		UEMsk:	DLP- SDES- TLP- FCP- CmpltTO- CmpltAbrt- UnxCmplt- RxOF- MalfTLP- ECRC- UnsupReq- ACSViol-
		UESvrt:	DLP- SDES- TLP- FCP- CmpltTO- CmpltAbrt- UnxCmplt- RxOF- MalfTLP- ECRC- UnsupReq- ACSViol-
		CESta:	RxErr- BadTLP- BadDLLP- Rollover- Timeout- AdvNonFatalErr-
		CEMsk:	RxErr- BadTLP- BadDLLP- Rollover- Timeout- AdvNonFatalErr-
		AERCap:	First Error Pointer: 00, ECRCGenCap+ ECRCGenEn- ECRCChkCap+ ECRCChkEn-
			MultHdrRecCap- MultHdrRecEn- TLPPfxPres- HdrLogCap-
		HeaderLog: 00000000 00000000 00000000 00000000
	Capabilities: [148 v1] Alternative Routing-ID Interpretation (ARI)
		ARICap:	MFVC- ACS-, Next Function: 0
		ARICtl:	MFVC- ACS-, Function Group: 0
	Capabilities: [1a0 v1] Transaction Processing Hints
		Device specific mode supported
		No steering table available
	Capabilities: [1d0 v1] Access Control Services
		ACSCap:	SrcValid- TransBlk- ReqRedir- CmpltRedir- UpstreamFwd- EgressCtrl- DirectTrans-
		ACSCtl:	SrcValid- TransBlk- ReqRedir- CmpltRedir- UpstreamFwd- EgressCtrl- DirectTrans-
	Kernel driver in use: vfio-pci
	Kernel modules: iavf


Collect lspci info for b1:01.5
b1:01.5 Ethernet controller: Intel Corporation Ethernet Adaptive Virtual Function (rev 02)
	Subsystem: Cisco Systems Inc Ethernet Adaptive Virtual Function
	Control: I/O- Mem- BusMaster- SpecCycle- MemWINV- VGASnoop- ParErr- Stepping- SERR- FastB2B- DisINTx-
	Status: Cap+ 66MHz- UDF- FastB2B- ParErr- DEVSEL=fast >TAbort- <TAbort- <MAbort- >SERR- <PERR- INTx-
	NUMA node: 1
	IOMMU group: 263
	Region 0: Memory at e50a0000 (64-bit, prefetchable) [virtual] [size=128K]
	Region 3: Memory at e6234000 (64-bit, prefetchable) [virtual] [size=16K]
	Capabilities: [70] MSI-X: Enable- Count=65 Masked-
		Vector table: BAR=3 offset=00000000
		PBA: BAR=3 offset=00002000
	Capabilities: [a0] Express (v2) Endpoint, MSI 00
		DevCap:	MaxPayload 512 bytes, PhantFunc 0, Latency L0s <512ns, L1 <64us
			ExtTag+ AttnBtn- AttnInd- PwrInd- RBE+ FLReset+ SlotPowerLimit 0W
		DevCtl:	CorrErr- NonFatalErr- FatalErr- UnsupReq-
			RlxdOrd- ExtTag- PhantFunc- AuxPwr- NoSnoop- FLReset-
			MaxPayload 128 bytes, MaxReadReq 128 bytes
		DevSta:	CorrErr- NonFatalErr- FatalErr- UnsupReq- AuxPwr- TransPend-
		LnkCap:	Port #0, Speed 16GT/s, Width x8, ASPM not supported
			ClockPM- Surprise- LLActRep- BwNot- ASPMOptComp+
		LnkCtl:	ASPM Disabled; RCB 64 bytes, Disabled- CommClk-
			ExtSynch- ClockPM- AutWidDis- BWInt- AutBWInt-
		LnkSta:	Speed unknown (downgraded), Width x0 (downgraded)
			TrErr- Train- SlotClk- DLActive- BWMgmt- ABWMgmt-
		DevCap2: Completion Timeout: Range AB, TimeoutDis+ NROPrPrP- LTR-
			 10BitTagComp+ 10BitTagReq- OBFF Not Supported, ExtFmt- EETLPPrefix-
			 EmergencyPowerReduction Not Supported, EmergencyPowerReductionInit-
			 FRS- TPHComp- ExtTPHComp-
			 AtomicOpsCap: 32bit- 64bit- 128bitCAS-
		DevCtl2: Completion Timeout: 50us to 50ms, TimeoutDis- LTR- 10BitTagReq- OBFF Disabled,
			 AtomicOpsCtl: ReqEn-
		LnkSta2: Current De-emphasis Level: -6dB, EqualizationComplete- EqualizationPhase1-
			 EqualizationPhase2- EqualizationPhase3- LinkEqualizationRequest-
			 Retimer- 2Retimers- CrosslinkRes: unsupported
	Capabilities: [100 v2] Advanced Error Reporting
		UESta:	DLP- SDES- TLP- FCP- CmpltTO- CmpltAbrt- UnxCmplt- RxOF- MalfTLP- ECRC- UnsupReq- ACSViol-
		UEMsk:	DLP- SDES- TLP- FCP- CmpltTO- CmpltAbrt- UnxCmplt- RxOF- MalfTLP- ECRC- UnsupReq- ACSViol-
		UESvrt:	DLP- SDES- TLP- FCP- CmpltTO- CmpltAbrt- UnxCmplt- RxOF- MalfTLP- ECRC- UnsupReq- ACSViol-
		CESta:	RxErr- BadTLP- BadDLLP- Rollover- Timeout- AdvNonFatalErr-
		CEMsk:	RxErr- BadTLP- BadDLLP- Rollover- Timeout- AdvNonFatalErr-
		AERCap:	First Error Pointer: 00, ECRCGenCap+ ECRCGenEn- ECRCChkCap+ ECRCChkEn-
			MultHdrRecCap- MultHdrRecEn- TLPPfxPres- HdrLogCap-
		HeaderLog: 00000000 00000000 00000000 00000000
	Capabilities: [148 v1] Alternative Routing-ID Interpretation (ARI)
		ARICap:	MFVC- ACS-, Next Function: 0
		ARICtl:	MFVC- ACS-, Function Group: 0
	Capabilities: [1a0 v1] Transaction Processing Hints
		Device specific mode supported
		No steering table available
	Capabilities: [1d0 v1] Access Control Services
		ACSCap:	SrcValid- TransBlk- ReqRedir- CmpltRedir- UpstreamFwd- EgressCtrl- DirectTrans-
		ACSCtl:	SrcValid- TransBlk- ReqRedir- CmpltRedir- UpstreamFwd- EgressCtrl- DirectTrans-
	Kernel driver in use: vfio-pci
	Kernel modules: iavf


